Video ID,Comment
aieQrj9Yy8s,110-120 pound girl beating on trained killers twice her size lol is she an avenger?
aieQrj9Yy8s,cant wait to watch that sex scene lol
aieQrj9Yy8s,i lost count after 132 boring cliches...
aieQrj9Yy8s,Thank you for not using a gazillion jump cuts.
aieQrj9Yy8s,"I was going like ""oh, maybe I'll watch this some day"" then there is Sofia Boutella naked and I am like ""oh, I am definitely gonna watch this as soon as possible"""
aieQrj9Yy8s,ladies and Gentelmens Now we know what Steven Seagal would look like if he was a woman!!! WTF
aieQrj9Yy8s,in what world could this women beat up two full grown men...
aieQrj9Yy8s,... просто БОМБА! Не могу оторваться от просмотра!
aieQrj9Yy8s,girl power
aieQrj9Yy8s,"This gets nominated for Academy Winner, but not John Wick... Mkay"
aieQrj9Yy8s,Anyone else just going through trailers?
aieQrj9Yy8s,"Well, looks like I have a reason to forgive Charlize for Furious 8!"
aieQrj9Yy8s,if there should be a female bond... this is it
aieQrj9Yy8s,le femme nikita??
aieQrj9Yy8s,Everything i need from a movie
aieQrj9Yy8s,"What I'm learning from this comment section is that John Wick has RUINED action movies for people. I mean I get it those movies and Reeves playing that character set the bar pretty dam high. Still though, it's a movie. Who cares that Charlize Theron couldn't fight her way out of a wet paper bag IRL. She's still fun to watch."
aieQrj9Yy8s,If there are no BLondie song in this movie i will be very disappointed.
aieQrj9Yy8s,I hope this movie not so bad if they use Queen for trailer...because after Suicide squad..
aieQrj9Yy8s,This movie will be a big flop
aieQrj9Yy8s,Jesus Christ. Can we please have one more comment with John Wick in it? I don't think we've had enough.
aieQrj9Yy8s,HOLY SHIT!
aieQrj9Yy8s,Love how Hollywood cries about gun control then drops millions on movies that glorify gun violence.
aieQrj9Yy8s,kiraa quiin daisan no bakudan!!!!!!!!!!!!! bait sa dasto :u
aieQrj9Yy8s,I can only hope this sort of movie doesn't persuade women they can actually fight men.
aieQrj9Yy8s,So many butthurt MRAs here.
aieQrj9Yy8s,James Mcavoy is in here too!!! 😍😊
aieQrj9Yy8s,"I can Watch Charlize Theron, Angelina Jolie, Kate Beckinsale, Zoe Saldana and Milla Jovovich play Fem fatale type roles all day"
aieQrj9Yy8s,In the end she dies and leaves her husband a letter and a dog right?!
aieQrj9Yy8s,All the comments in the comments section are about james bond and john wick
aieQrj9Yy8s,Why can't feminists at least not touch James Bond and John Wick jesus christ
aieQrj9Yy8s,Ok let me be the first to say this I can see her & John wick in the same movie up against each other i bet it happens
aieQrj9Yy8s,hahahaha feminist john wick
aieQrj9Yy8s,when JOHN WICK meets HITMAN !!
aieQrj9Yy8s,Everybody is playing classic pop songs now to sell their movie.... Guardians of the Galaxy paved the way hhhhhh
aieQrj9Yy8s,So...Ghost in the shell...i hate it when studios do this to scarlot johanson...everytime she does a movie..studios release a competing counterpart...EVERYTIME
aieQrj9Yy8s,"mulheres se pagando é muito gostoso de  ver.
já gostei.uauaiaiaiai"
aieQrj9Yy8s,Fights look like John Wick on 0.5x speed
aieQrj9Yy8s,"I love Charlize, but such thin woman can't, just can't fight two man in melee, take hits into head, body and simply stand up and knockout them after."
aieQrj9Yy8s,"The lesbian thing was a bit too much, disturbing and rudely unexpected. There has to be something said about all the young impressionable teens who will watch this."
aieQrj9Yy8s,goddamn i hope this isn't what they turned the grey man into.
aieQrj9Yy8s,meh
aieQrj9Yy8s,Mrs John Wick
aieQrj9Yy8s,This looks awful.
aieQrj9Yy8s,"I am going to see this!. Purely for the action, definitely not for the super hot girl on girl action. I love action."
aieQrj9Yy8s,Whats the song?
aieQrj9Yy8s,Would love to see this be part of the John Wick universe.
aieQrj9Yy8s,lesbic 👎
aieQrj9Yy8s,Looks good
aieQrj9Yy8s,"This was the Jane Wick, wife of John Wick"
aieQrj9Yy8s,Good slow motion music for bad slow motion fighting moves!
aieQrj9Yy8s,is charlize theron taking martial art classes with danny trejo???
aieQrj9Yy8s,"nice choreography but her weird dull voice ruins everything for me, every time ugh"
aieQrj9Yy8s,wtf is this lame stupid shit
aieQrj9Yy8s,"this looks great...the hell with all you people who want to make the best John Wick jokes in hopes to be quoted.
This looks like a straight forward action shoot'em up flick...the only difference I see , is that it main protagonist is a female in stead of your standard male actor...And I'm all the way cool with that!"
aieQrj9Yy8s,Theron getting​ kicked hard and kicking ass harder
aieQrj9Yy8s,"Get your bags,welcome to Berlin 
For fuck sake"
aieQrj9Yy8s,Oh bollocks!
aieQrj9Yy8s,"Remake of salt, she looks like angelina jolie too"
aieQrj9Yy8s,Plot twist this is in the John Wick universe
aieQrj9Yy8s,the just show the whole fuc$^&^*(ng movie just show all stupid trailers are too long just give us the tip not the entire 12 inches fuc$^&***(c !!!!
aieQrj9Yy8s,OOH KAY... IT'S 'SALT' MEETS 'JOHN WICK' WITH A PINCH OF 'TAKEN'... LOL... HOLLYWOOD IS DEFINITELY RUNNING OUT OF IDEAS...
aieQrj9Yy8s,Joan Wick
aieQrj9Yy8s,the action scenes seem poorly acted :/
aieQrj9Yy8s,surprisingly... it actually looks like it might be .. good.. 😕
aieQrj9Yy8s,"The fight scene in the stairs would have been good, if every time she got hit didn't look fake as hell. And her recovery was near instant and also poorly acted."
aieQrj9Yy8s,hot hot hot!!! I love females in action
aieQrj9Yy8s,"who else got ""SALT"" vibes?"
aieQrj9Yy8s,WTF is wrong with people these days bashing atobies because of 90pound woman is lead seriously then why the fuck you all watch superhero movies they have nothing to do with reality stupids everywhere use whatever fits
aieQrj9Yy8s,blonde wick?
aieQrj9Yy8s,john wick version hot gyall...?
aieQrj9Yy8s,"That looks pretty cool! Also, Theron is just great. She seems to be like Keanu Reeves, un-aging... scary..."
aieQrj9Yy8s,OMG I 90lb woman getting hit and taking out hit men....ugh
aieQrj9Yy8s,Joanna Wick
aieQrj9Yy8s,This woman will never get old.
aieQrj9Yy8s,Looks like it could be cool but something tells me it will be lame!
aieQrj9Yy8s,Yeah no... I call bullshit on this one...
aieQrj9Yy8s,Johna Wicker
aieQrj9Yy8s,hello guys my channel is the same channel Zero Media So subscribe and his will be happy for me and for you :D
aieQrj9Yy8s,Salt II
aieQrj9Yy8s,As senas de luta é muito mal feita! Não é conveniente.
aieQrj9Yy8s,looks cool and Charlize is hot
aieQrj9Yy8s,Wick genre
aieQrj9Yy8s,AKA female john wick.
aieQrj9Yy8s,Apparently feminists saw John Wick
aieQrj9Yy8s,Is this Jessica wick ?
aieQrj9Yy8s,I love that this trailer doesn't feel as though it lasts longer than 3 minutes.
aieQrj9Yy8s,So John wick 3 is looking different
aieQrj9Yy8s,Joan Wick - John Wick's estranged wife???
aieQrj9Yy8s,I've seen a lot of negativity online about this trailer already but I actually think it looks great. The fight scenes look amazing and well shot plus it's good to see a female actress clearly doing most of her own fight work. The only negative for me was the combat sound effects. If that trailer didn't convince people then also bear in mind it's from one of the John Wick directors.
aieQrj9Yy8s,They should've just called the movie Jane Bond
aieQrj9Yy8s,"Holly fucking shit, from John wick director! I'm hyped"
