Video ID,Comment
zSWdZVtXT7E,hahaha...travelling to space is like taking a flight back n fro??? simpleton
zSWdZVtXT7E,STEP BY STEP - STEP#1
zSWdZVtXT7E,"Daily fantasy sports fan? Become fantasy sports royalty, only at statkings.com.ï»¿"
zSWdZVtXT7E,"humanity already can survive any cataclysm...
we can borroow underground and live there (11000 meters unerground is more than enough to shild our kind for nearly any kin of threat)
termo and nuclear reactors + watter = nearly endless energy supply for a not that small community of 1-5 millions survivors (more than enough to save our kind)
energy can be used to grow crops even in total darkness, to create underground a normal ecosystem...
we alreay have enough knowledge to survive on earth, under earth and water, even to create a good spacestation for few thousands to live more than few generations...
our knowledge are far beyound our needs for survival of our kind...
but still we want more...not to be sure about our survivability but to spread our kind to new worlds...to have new beginings...to have new future...to have more diffirence...to study this world we all live in...to find something new...
most powerful force in humanity is Interest...love is only one of many kinds of it,,,

these films about space treveling are to grow interest in this direction to make it faster and cheaper for billioners and goverments

how many words of danger were said about ""need"" in this direction?
sun is dying, we need to look for a new home (nonsense! sun will be ""dying"" for next 5,000,000,000,000 years...its age total is like 4.500.000.000.000 years...when our kind's age by many ressearchers are less than 500.000 ...and known hisstory is less than 10.000 ....just few centuries ago we did't realize that our world isn't flat...)

we run out of food? i mean srsly? you must be joking cause ONLY GERMANY!!! DESTROYING EACH FUCKING YEAR 20.000.000 TONS!!! OF DAMN FOOD!!! which is nearly half of its own consumption!...and you talking about ""we runout of food""?????? O____o how damn stupid a common man is in their eyes?
or may be they are right...and we all that stupid so they don't need to ""waste"" their money to buy better scenarios? to make better movies?

only real point to leave this planet is to escape these govements to build better society...cause this one is sick as hell and there is no fucking way to change it..."
zSWdZVtXT7E,"Mixed reviews of this film, some critics say he came close to his masterpiece, others say you need to have swatted up on your quantum mechanics and that the plot is quite complex. In other words - it's going to be pure awesome, and possibly an epic adventure film meant for an intelligent audience for once. Hopefully."
zSWdZVtXT7E,"I'm afraid this will be another disappointing sci-fi movie, like Gravity. It will probably be filled with all sorts of misconceptions about space, even though Kip Thorne has been the scientific consultant for it (and also executive producer). Remember the movie ""Sunshine"" from 2007? Brian Cox was the scientific consultant for that one, and yet the movie was filled with all sorts of misconceptions and inaccuracies that made me laugh.
And what about Gravity? That unknown force that pulled Clooney away from the ISS was a total joke, same for the orbital nonsense between the Hubble, the ISS and the Russian satellites, etc.

Just so you know, Interstellar tells the story of a group of astronauts who ""travel"" through a black hole...with hopes of going somewhere else and then return to Earth, that is. For all science knows, the laws of physics break down inside a black hole due to the tremendous gravitational pull, that means that we can't possibly know, through physics, what happens exactly to things that cross the ""event horizon"" (that's the edge of the black hole, so to speak).Â 
All science can tell for sure is that when something crosses the event horizon, there's no turning back, if you somehow managed to come out, it wouldn't be alive and in one piece. When Hawking talks about how it is possible for information to be preserved inside a black hole, it just means INFORMATION, in other words, the particles that form your body could still be ""preserved"" somehow but you would die nonetheless, all your atoms would be undone, and that isn't pretty.
Whoever tells you that you can travel through black holes (survive the journey and come back to the same universe as if nothing happened, that is), doesn't have the math/mechanism to support this claim and Kip Thorne knows it.
I bet all Kip has done is to help model the black hole, give direction to actors who will play scientist roles and perhaps a few more things, but I'm pretty sure this movie will still contain nonsense. Sci-fi directors usually claim they've made sure everything is scientifically accurate, showing us stuff like this>Â  Interstellar â€“ Building A Black Hole â€“ Official Warner Bros.
so people can say ""Oh! This time they've got it right!"" when, in reality, only some things are accurate, the rest is usually nonsense. Movies like Sunshine and Gravity are clear examples of this.
Curiously, there is a 1968 movie called ""2001: A Space Odyssey"" (perhaps you've heard about it, LOL) that gets most things right, without the need of using unlikely black hole travel, without the need to sell it for its ""realism"" or scientific accuracy, without flashy special effects, absurd amounts of money and without being too pretentious.
The non-scientific parts of that movie are highly symbolic, which make it even better.

So Hollywood sci-fi movies nowadays have much larger budgets, a much higher availability of professionals from all branches, highly superior technology available, they generate much more money, etc. and yet they are worse every year... Why is that?
I think it's because the essential guidelines of the business are wrong. They go for flashiness (big names, high numbers, extreme and flashy plots, etc.) instead of quality, they try to conciliate science with nonsensical extreme plots that are completely incompatible and absurd (my point being> don't try to sell the movie for its realism and accuracy if, in the end, it won't be so).
This is the formula: big names + claims of scientific accuracy/realism + extreme plots filled with nonsense (the world is about to end, there's a critical accident/everything goes wrong, and the like) + stuff blowing up/getting destroyed + miraculous survivals + ultra hd cameras and all sorts of modern filters and effects + the hero saves the day (requiring his/her/their sacrifice, perhaps) = Next Hollywood sci-fi movie."
zSWdZVtXT7E,like this trailer.......as always christospher nolan Â the best
zSWdZVtXT7E,"I like how he avoids using CGI whenever possible. Even the lighting here isnt bright/flashy.
It gives such realistic experienceÂ to his story telling. A lot of Hollywood films could learn from this kind of idea.
Cant wait to see this movie in theatres!!!"
zSWdZVtXT7E,"soundtrack please
???????????????"
zSWdZVtXT7E,i feel like this movies is about how the illuminate plan to save themselves from the natural destruction that may come to earth in the future..
zSWdZVtXT7E,The Astronaut Farmer 2
zSWdZVtXT7E,I wanna thank Stanley kubrick behalf of all for his tremendous work in 2001:A Space Odyssey which leads to this creation .
zSWdZVtXT7E,"Song: Every Reborn - Dario Marianelli Â -> Known from ""V for Vendetta"".Â "
zSWdZVtXT7E,Black holes don't exist
zSWdZVtXT7E,"The one thing I hate about moving to a small(er) town, there are NO IMAXes anywhere!"
zSWdZVtXT7E,"Interesting how this trailer uses music from V for Vendetta, Iv'e never heard of film using prior music scores at least for trailers. Can anyone shed light on this, or give other examples?"
zSWdZVtXT7E,much awaited movie for me
zSWdZVtXT7E,Can't wait to go see this movie on 5th nov!
zSWdZVtXT7E,"Stupid, stupid, stupid. The whole premise is stupid, the lines are stupid, the black hole/wormhole scene is stupid.Â "
zSWdZVtXT7E,Heyy everyone. Check out my channel & my reaction the 3rd trailer of this movie. GOSH I am so excited.... Interstellar Trailer 3 Reaction
zSWdZVtXT7E,"So is this just ""fly into a black hole"" the movie essentially? Nolan sure knows how to make it seem a lot more interesting than that."
zSWdZVtXT7E,spoiler alert hes coming back
zSWdZVtXT7E,go further
zSWdZVtXT7E,"They used the soundtrack from V For Vendetta !!!!
Evey Reborn !!!!!"
zSWdZVtXT7E,"Cant wait to watch this movie. Why you ask? Becuase ""JURASSIC WORLD"" trailer is being released in the preview of this movie!!!!!"
zSWdZVtXT7E,Anyone recognise the music?
zSWdZVtXT7E,"Nolan, McConnaughey and Zimmer.........really can't see how this one can fail :)"
zSWdZVtXT7E,"The crew was killed, he never came back. Â Well, that took 12 minutes to get to that point so this film will make more money per minute than any film before it. Â Oh, the film is continuing?... it has them LIVE?! Â WHAT!? Â NO WAY!? Â Oh look at all the pretty special effects. Â Ok, let's have the IMPOSSIBLE happen because Kip Thorne wants to be known as an Imagineer like Einstein was, he wants his legacy to be that he imagined further than his knowledge should have allowed, he was a hero. Â SO for that personal objective, we are now going to be fed a bag of worms about how people can survive going through a wormhole... oh great! Â So first he tries to teach us that engineers are obsolete, then he tries to teach us that science built this thing!?? Â NOPE TO BOTH. Â In the scenes they pull the power pack processing package from the Indian drone, as useful... oh wait, that's engineering. Â Then they say we ran out of food, what... did engineering fail to come up with solutions? Â NO WAY, engineers would have had people living where ever, with desalination wholesale, protected from radiation. Â Listen, if engineering can build a star ship to go exploring to move MILLIONS of people off this planet, the same engineering would have built the systems to remake a new place to live on Earth, probably under the sea! Â So this whole movie is based on... Kip Thorne playing around with his legacy. Â So yeah, they all die and the movie ends after 12 minutes. Â Let's all get refunds!! Â hehe"
zSWdZVtXT7E,Looks really good. Glad that a big movie is coming out that has nothing to do with shooting at eachother
zSWdZVtXT7E,"God, this trailer made me tear a bit while watching it. And I blame it for Matthew McConaughey's brilliant acting. Can't wait to see it onÂ IMAX screens."
zSWdZVtXT7E,Little Emma Stone is there 
zSWdZVtXT7E,"Looks like a gripping yet intelegent sci-fi movie, a rare thing these days. This is so on my to watch list. : )"
zSWdZVtXT7E,Alfred!!
zSWdZVtXT7E,Please don't be like the movie Red Planet.. hah
zSWdZVtXT7E,Sorry to say this but even as a Christopher nolan fan this film looks boring as hell
zSWdZVtXT7E,what a powerful film.
zSWdZVtXT7E,lame ..
zSWdZVtXT7E,"Just as somebody commented, ""In Nolan we trust"""
zSWdZVtXT7E,Oh Boy Oh Boy O Boy !!!!!!!! Can't wait.....
zSWdZVtXT7E,Empire's coverage of Interstellar is incredible in itself. This movie is a definite must-see already.
zSWdZVtXT7E,Nolan and Caine back together again <3
zSWdZVtXT7E,i hope they play this in the ending credits Planet Caravan - Black Sabbath
zSWdZVtXT7E,I saw the one movie not too long ago with astronauts in space trying to fix a satellite and all hell breaks loose. this seems like it goes beyond what the movie was trying to pull off. seeing imagination and creativity in space movies are always awesome. I would def watch this movie.
zSWdZVtXT7E,I want it in hungarian tooo!!!!
zSWdZVtXT7E,This trailer is a masterpiece in both music and dialog.
zSWdZVtXT7E,Matthew McConaughey was driving spacecrafts long before anybody paid him to drive one!
zSWdZVtXT7E,Nolan is overrated
zSWdZVtXT7E,Yeah I've watched a few of these trailers now and I fail to see what's so special about them. Or perhaps everyone else is on the Nolan bandwagon.
zSWdZVtXT7E,Goosebumps! Can't wait!
zSWdZVtXT7E,INTERSTELLAR TRAVEL
zSWdZVtXT7E, #interesting Â 
zSWdZVtXT7E,Matthew deserve to be the next Bruce Wayne instead of Batfleck!!!
zSWdZVtXT7E,Daft Punk - Interstellar 5555
zSWdZVtXT7E,"Nolan will never make a bad movie
That dude is really amazing
Memento and Inception are the two best movies I have ever watched
And do I need to say anything about the Batman movies"
zSWdZVtXT7E,well if its a nolan film and the score is from hans zimmer its definitely worth a movie ticket imo
zSWdZVtXT7E,please be friggin' awesome... PLEASE!! Nolan!!!!!!!!!
zSWdZVtXT7E,so this is the mivie version of Civilisation Beyond Earth?
zSWdZVtXT7E,"It takes a lot for me to express my ideas. Â This move will be phenomenal, and the physicist/astro-physicist side of me takes hold. Â This isn't just a movie. Â It's about changing the way we think about the world as a whole. Â It will take change - change in the way you think, feel, react, but it has to be done. Â We won't survive unless we can adapt."
zSWdZVtXT7E,Simply the best trailer ever!
zSWdZVtXT7E,This trailer gives me so many goosebumps. Soooo excited!
zSWdZVtXT7E,"This movie can easily be a dream within a dream by talented, steadfast, in addition, reflective director, Christopher Nolan. He, Nolan, is a master, beyond time. We'll find a way as we always have to once again enter his world. Beyond time.ï»¿"
zSWdZVtXT7E,I can already see the Oscar nominations 
zSWdZVtXT7E,Of course...the NASA...and not ESA or any (!!!) other Space Agency...two American Crewmembers with a Hillbilly Pilot...bitch just killed my vibe
zSWdZVtXT7E,Dude i play the game its very cool we are creating our galaxy
zSWdZVtXT7E,George Clooney must be an astronaut!
zSWdZVtXT7E,Doesn't look very funny.
zSWdZVtXT7E,Movie looks breathtaking.  Can't wait to see it
zSWdZVtXT7E,Does anyone know where I can get the music in this trailer?
zSWdZVtXT7E,Does anyone know what the name of the music is ? I know it's from v for vendetta  
zSWdZVtXT7E,"Aaaaaaaaaaah, the girl from The Conjuring!!!!! She was amazing. So happy to see her in another hit movie :)"
zSWdZVtXT7E,"The Prestige, Memento, Dark Knight, Inception, etc..
Nolan has never let me down, can't wait for this film."
zSWdZVtXT7E,I can't wait to hear the full score!!!!
zSWdZVtXT7E,"I love movies like this ðŸ’™ definitely a must see . I believe it's very possible for interstellar travel , just look at what us humans have already accomplished . It's amazing "
zSWdZVtXT7E,"let me get this straight

a movie about the world running out of food takes place in a lush, green field of corn

ooooookayÂ "
zSWdZVtXT7E,what is the name of the soundtrack?
zSWdZVtXT7E,Deep
zSWdZVtXT7E,Can somebody please tell me the name of this piece of music? :)
zSWdZVtXT7E,Great trailer but anyway people will some day be gone from earth because of our one faults of destoying the earth
zSWdZVtXT7E,"Every hour on this new planet is seven years on earth.  Bring an alien plant home, it grows at an excelerated rate on earth, now we eat.  Problem solved."
zSWdZVtXT7E,I am so ready for this..
zSWdZVtXT7E,"I'm looking forward to interstellar just as much as any film fan, but my only grip about the movie is that for a movie about "" saving the WORLD"" Â the people behind the mission who gives a damn is AMERICANS doing all the work with no help for other countries. which is a bit disturbing to see. A movie that solves this problem was Danny Boyle's Sunshine"
zSWdZVtXT7E,WHY ARE THEY USING MUSIC FROM V FOR VENDETTA?! WHYYYYYYYYYY
zSWdZVtXT7E,Trailer is very nicely done. Does anybody know the music used in this?
zSWdZVtXT7E,I havn't been this excited for a scifi movie in a long time. I've been waiting for another scifi that pushes the boundaries of fiction and introduces real science and philosophy. Looks fantastic.
zSWdZVtXT7E,"If space is infinite, there can be nothing that is unique. An infinite number of Earths, in an infinite number of variations. Only problem..they are each an infinite distance apart. Bummer!"
zSWdZVtXT7E,that music is v for vendetta
zSWdZVtXT7E,The trailer is already better than most recent sci-fi films.
zSWdZVtXT7E,Why I think of Armageddon..
zSWdZVtXT7E,"I don't understand the issue about ""mumbling"". I hear it perfectly clear. Maybe because I am a Finn, and used to people talking in strange ways to me.

But dubbing sucks. Nobody in his or her right mind would want to see a movie in any other language it is made. Unless we are talking of Disney or Dreamworks kiddie cartoons.

All that said, I expect this flick to kick major ass. Mine included."
zSWdZVtXT7E,"Isnt the music ""Eve Reborn"" By Dario Marianelli, from V For Vendetta??"
zSWdZVtXT7E,I feel like Nolan asked Matthew McConaughey to do his best Christian Bale impression. I think it would have been more interesting had he asked Leonardo DiCaprio to do his best C. Bale impression.Â 
zSWdZVtXT7E,Spent the entire thing distracted by the use of the same music from Batman
zSWdZVtXT7E,Anybody else catch the V for Vendetta music?
zSWdZVtXT7E,"Is anyone else peeved that they ripped off part of the soundtrack of V For Vendetta? You'd think that a *ahem* talented director like Nolan would be able to ""score"" some original music for the trailer."
zSWdZVtXT7E,Can someone please tell me the music for this specific trailer?
zSWdZVtXT7E,"Murph is wearing his jacket @1:41#FEELSÂ 

This film is gonna make me cry cause I have a feeling Murph will be an old woman by the time her dad comes back, and he will be YOUNGER than her..."
zSWdZVtXT7E,"murfizlah: what ever can go wrong, will go south.Â "
zSWdZVtXT7E,Is That The stripper Cowboy from Magic Mike?
zSWdZVtXT7E,This is weird that soundtrack isn't it from v for vendetta when evey is reborn?
zSWdZVtXT7E,This is gonna be good
zSWdZVtXT7E,"Stephen Hawking believes humans need to leave this planetÂ within the next 1000 yearsÂ before all of its resources are used up due to overpopulation. That is being optimistic, 500 years is more likely. I don't see it happening considering the closest dwarf star that could possibly have a inhabitable planet in millions of light years away and we haven't even been to Mars yet. Personally I think it will be a pandemic that will wipe us out, especially how strong and resilient anti-biotic resistant bacteria has become."
zSWdZVtXT7E,Uk release date?Â 
zSWdZVtXT7E,music?
zSWdZVtXT7E,Does anyone know this music for this trailer? It's amazing
zSWdZVtXT7E,I agree those words on the trailer.
zSWdZVtXT7E,big hero 6 it will be the winner of this weekend........................
zSWdZVtXT7E,I wants to see
zSWdZVtXT7E,Gud casting except annie hathaway
zSWdZVtXT7E,"Is Neil deGrasse Tyson doing the black hole effects?
FYI Yes I know that it's technically a worm hole, but worm holes are theories formed from black holes, which are also theories, making worm holes... improbable.
Warp drive > worm hole"
zSWdZVtXT7E,"I don't usually like Nolan, but this looks great. He seems to have stepped up his directing because this is top notch."
zSWdZVtXT7E,cant wait.
zSWdZVtXT7E,"
The music in the background is from V for Vendetta!ï»¿"
zSWdZVtXT7E,isn't that girl the one who played the role of Renesmee from Twilight Breaking Dawn?
zSWdZVtXT7E,"Like others said I say : 'This is going to be great !' 
I wish we could travel in Space like that."
zSWdZVtXT7E,Matthew is the next Tom hanks! I know it. 
zSWdZVtXT7E,"I wish my self we could do this, travel to different worlds or to different galaxy. See clusters of stars, cluster of galaxies , and some nebula's parts. I love the beauty of just seeing the milky way, it is such beauty just to see it by the naked eye. But what make us think our Creator of this world would let us go out there? He would probably laugh us cause we can't even control our selves they right way on this world XD .... But FOR REAL .. Lord have mercy on us..Â "
zSWdZVtXT7E,WALL-E
zSWdZVtXT7E,This movie looks like its going to be sick as hell.Â 
zSWdZVtXT7E,Gravity (movie) X 2!!!!
zSWdZVtXT7E,that's more Â like it.
zSWdZVtXT7E,"Someone help me, where have we heard this music before? It's been the soundtrack to another film but i can't quite place it. Meet Joe Black?"
zSWdZVtXT7E,BG is from Shawshank?
zSWdZVtXT7E,I hope movie ll hav best cosmic elements and contents....
zSWdZVtXT7E,"nah.... I already saw the movie ""Gravity"".. thats enough"
zSWdZVtXT7E,Why have they ripped off the track from V for Vendetta???
zSWdZVtXT7E,is that the girl inprinted by the wolf?
zSWdZVtXT7E,Beyond earth.....
zSWdZVtXT7E,im confused please tell wat its about
zSWdZVtXT7E,"I'll still watch it, even if people claim it sucks. I'm an astronomy junky that hopes to explore space someday"
zSWdZVtXT7E,What is the name of song in this trailer?? ~absolutely amazing~
zSWdZVtXT7E,"Loving that V for Vendetta music... ""God is in the rain."""
zSWdZVtXT7E,Cant tell if this is based on the mobile game lol or if the game is based on this. Even though the mobile game is already out. 
zSWdZVtXT7E,Maybe the trailer does spoil some things since it shows that Matthew's children have become adults......
zSWdZVtXT7E,"Ooooh, excited for this, loves me some space films.
Am curious about the music they used for this trailer, anyone know what it is? Sounds familiar."
zSWdZVtXT7E,"Please do not disappoint..movies encompassing space travel normally end up being mediocre at best unless they are complete fantasy like star wars or star trek. since the groundwork of this movie is based on a derivation of reality, i am a bit cautious, nevertheless hopeful."
zSWdZVtXT7E,V for Vendetta \m/ (the music)
zSWdZVtXT7E,FINALLY A CHRISTOPHER NOLAN FILM AND NOT STUPID ASS MICHAEL BAY MOVIE!
zSWdZVtXT7E,I love those kind of movies lolÂ 
zSWdZVtXT7E,world doesnt need anymore engineers?! PFFT!
zSWdZVtXT7E,Music from V for Vendetta.
zSWdZVtXT7E,"2nd Best CGI I've ever seen in a movie. 1st is Avatar, of course."
zSWdZVtXT7E,I hope they don't devote half the movie to his daughter's whining.Â 
zSWdZVtXT7E,pfff im so pumped up for this whole space sci fi epicness
zSWdZVtXT7E,Trailer looks  similar to works of inception and TDKR.Especially the stadium scene remainded me of TDKR stadium scene. Also will Nolan be able to meet huge expectation that the movie has been garnering????
zSWdZVtXT7E,Any one notice mackenzie from twighlight?
zSWdZVtXT7E,Christopher Nolan is a lazy writer who makes plot hole ridden scripts. And after the B movie style special effects from TDKR why be excited about this movie.
zSWdZVtXT7E,"What I if told you


You read the top line wrong"
zSWdZVtXT7E,AVENGERS AGE OF ULTRON!
zSWdZVtXT7E,"""the world doesnt need anymore engineers""

words you will never hear any honest or serious professional say"
zSWdZVtXT7E,Super excited. Isnt the background score from V FOR VENDETTA? really sets the mood!
zSWdZVtXT7E,The trailer looked awful when I went to see Teenage Mutant Ninja Turtles.
zSWdZVtXT7E,I'm seeing this movie for the sake of The Avengers: Age of Ultron trailer being attached to it.
zSWdZVtXT7E,if i have to i will watch the cam print.......i cant wait for it to come to theaters that Looong....
zSWdZVtXT7E,"I have strange feeling that this movie will be 90% drama and 10% (at very end) space travel which will be disapointment for all of you ""i cant wait this movie""..."
zSWdZVtXT7E,You know what makes this movie good???? 35MM FILM!!!!!! Suck on that digital lovers. 35mm film will always be superior to digital.
zSWdZVtXT7E,Wouldn't the black hole rip apart the ship particle by particle? That's what I was tild in school anyway.
zSWdZVtXT7E,im crying
zSWdZVtXT7E,"Chris Nolan, Hans Zimmer, Michael Caine, Mathew McConaughey, Anne Hathaway............ I cannot wait.......This could not go without an Oscar......"
zSWdZVtXT7E,check out our parody on our page!Â 
zSWdZVtXT7E,Goddamn that soundtrack!
zSWdZVtXT7E,Elite : Dangerous
zSWdZVtXT7E,My science teacher is in this ??!!!!!! 0.41 secs in the dead centre hahaha
zSWdZVtXT7E,V for Vandetta music much xD
zSWdZVtXT7E,Music is feom v for vendetta ending
zSWdZVtXT7E,surely there has to be another michale caine somewhere. i'm getting tired of this one.Â 
zSWdZVtXT7E,As they were traveling there was 2 planets the first one looks like Jupiter and there was a second one that was black and there were stars rotating around it what planet is that or even if it is a planet ?
zSWdZVtXT7E,"Wow they hardly showed any Anne Hathaway. 
That's embarrassing "
zSWdZVtXT7E,So hyped for this
zSWdZVtXT7E,Oh hai! Have you heard the talk about - TK Explosion Easy Website Builder (should be on google have a look)? Ive heard some interesting things about it and my cousin got amazing results with it.Â 
zSWdZVtXT7E,Greenhouse effect with rising carbon dioxide will spur on plant growth not diminish it.
zSWdZVtXT7E,Greenhouse effect with rising carbon dioxide will spur on plant growth not diminish it.
zSWdZVtXT7E,I already love it!
zSWdZVtXT7E,that's Oscar material
zSWdZVtXT7E,freaking great stuff!
zSWdZVtXT7E,Â Uhmmmm I don't know how to say this.....but I got the chills from that for some reason!
zSWdZVtXT7E,This trip is the wing speed wing light or travel to other planets someone design me concerned
zSWdZVtXT7E,"I downloaded and played the phone game before I even knew it was a movie. Just today I saw the ""see interstellar blah blah blah"" and im watching the trailer now and I remember seeing it before but I didn't notice it was called this. And I have to say, the game is probably the best mobile movie game I've ever played. "
zSWdZVtXT7E,this movie will be remembered as the movie Christopher Nolan has become the best filmmaker in the world
zSWdZVtXT7E,This gonna be my favorite film
