Video ID,Comment
zSWdZVtXT7E,"Ship comes straight from Icarus/White Engine.Â  A football shape spaceship surrounded by 1 or 2 rings.Â  So, they're looking to create a space warp bubble.Â  It's not a 1 way mission, not an occuring wormhole, it's meant to be self generated."
zSWdZVtXT7E,Hello there warp drive 1:53 .
zSWdZVtXT7E,"This looks brilliant, an intellectual sci-fi movie with impressive visuals , a great cast, an amazing director, this will be flawless."
zSWdZVtXT7E,I Love theis 
zSWdZVtXT7E,.
zSWdZVtXT7E,"yae
"
zSWdZVtXT7E,"So instead of trying to clean the Earth,from pollution that Humanity did, home of our civilization,that we should care and protect,humanity decide to find another planet like Earth,wich I doubt will be sitting and waiting just for us,because you know....,there might be already someone living there,but noo lets just get another planet to screw up again,yaay,why not?,we can do this forever. Until Humanity doesn't learn to care about the planets they live on,they won't have a future in space. nonetheless the Trailer looks interesting I hope the movie will have some lessons toÂ learn from it."
zSWdZVtXT7E,propaganda
zSWdZVtXT7E,"Right because interstellar space travel is way easier then planting new corn.

0/10 Fail!"
zSWdZVtXT7E,Gravity 2?
zSWdZVtXT7E,"I can't wait. Looks like the perfect movie to watch when Sid Meier's Civilization: Beyond Earth comes out. Thanks for the great entertainment, guys!"
zSWdZVtXT7E,All the people thinking the warp scene is right before the credits..the hell is wrong with you?
zSWdZVtXT7E,"Trailers always misleading!Â 
But the idea that Matthew is the movie starÂ makes me curious about this upcoming movie ."
zSWdZVtXT7E,sick
zSWdZVtXT7E,"Nolan + Kaine, better love story than twilight :D"
zSWdZVtXT7E,something tells me he is going into the past..
zSWdZVtXT7E,"I am very excited for this, i have never been more excited for a trailer like this one, even more than any other movie coming out. I just hope its not a action movie, where people are dying and things a re blowing up. But an actual explorer movie through space.Â "
zSWdZVtXT7E,Maybe they go through a wormhole and end up back in time and then stop mankind from polluting the Earth or some other such mumbo jumbo?
zSWdZVtXT7E,This looks good!!!Â 
zSWdZVtXT7E,"The backstory to every good shmup, you're a little late 'merica."
zSWdZVtXT7E,The sound track is good 
zSWdZVtXT7E,The trailer itself is amazing
zSWdZVtXT7E,Dammit D:
zSWdZVtXT7E,So that's why that guy left true detective
zSWdZVtXT7E,Time dilation. Mcconaughey goes through a wormhole for a few minutes and comes back to find that many years have passed on earth.
zSWdZVtXT7E,Throws money at the screen.
zSWdZVtXT7E,"Doesn't quite grip me like the trailer for Gravity did, but sure, I'll check this out - just hope the acting is as good as it was in Buyers club...Â "
zSWdZVtXT7E,"This looks quite good  he was a great actor in public enemys and  batman 1,2 so this film looks great and wih him it should be an awesome film "
zSWdZVtXT7E,"I have absolutly no fucking idea what the fuck i just saw.... They are out of food but they live in a farm? The world is ending but they still playing baseball and shit. What? Indian drones flying around for no reason on what looks to be american soil. Bwhat the actuall fuck is this.

Why are people saying they love this and that it is awesome? Its literally the worst trailer ive ever seen. Im confused as fuck.Â "
zSWdZVtXT7E,I wish Nolan would direct Star Trek movies.
zSWdZVtXT7E,"Christopher Nolan never fails, i have no doubt that this will be the Movie of this Year."
zSWdZVtXT7E,Chris nolan???? Sold :D cant wait!!!
zSWdZVtXT7E,looks like a really good movie
zSWdZVtXT7E,Can i book my tickets already??
zSWdZVtXT7E,"From what's already been said, I know absolutely diddly dick about what this film is about and I'm not even going to try to guess. Whether this film turns out to be a piece of shit, an average film or a masterpiece, I'd be damned if this didn't feel cinematic. This is why I go to the movies and love them so very much."
zSWdZVtXT7E,Alfred!
zSWdZVtXT7E,Looks awesome 
zSWdZVtXT7E,Booo! Looks shit 
zSWdZVtXT7E,Looks promising. But I thought the same when I watched the trailer of Transcendence a couple of months ago. That movie was kinda hyped but it turned out to be a bummer.. let's hope Interstellar will do better :)
zSWdZVtXT7E,Well that was shit. Nolan you fucking hack
zSWdZVtXT7E,Man if Nolan did a Suikoden film OMG
zSWdZVtXT7E,The warp drive even looks like the way they said it would need to be :D 
zSWdZVtXT7E,2 millions in one day
zSWdZVtXT7E,"Man !!!
They revealed all the suspence :(
Anyways.... still desperate."
zSWdZVtXT7E,"I am excited for this movie BUT I will still be waiting for a Mass Effect film adaptation.If not the story of the trilogy of video games.Then , a prequel about the First Contact War.For those who've never played the games, the prequel story goes like this:Man Â goes to Mars in the 2140s, discovers the technology of an Ancient more advanced civilization,that tech jumps human tech 200 years forward and helps man achieve FTL travel , man travels beyond and discovers the Mass Relays(which are literally portals that ""sling"" you from one point in the galaxy to another in a matter of seconds), man decides to go beyond that mass relay and comes face to face with a new alien race and all this nearly cause a war /diplomatic episode etc etc I . It would be such a cool film.Sci-fi/Exploration/Adventure/Political Thriller.Not the typical ""aliens invade earth to exterminate us"" plot.Someone pleaaase make this happen!"
zSWdZVtXT7E,It's a wormhole
zSWdZVtXT7E,Cornball
zSWdZVtXT7E,Looks crap
zSWdZVtXT7E,Wow! What a Trailer!! *-*
zSWdZVtXT7E,This looks like an awesome movie but it's terrifying how accurate the implication is that it'll take near extinction to finally get humanity to contemplate undertaking interstellar travel
zSWdZVtXT7E,I wonder if there will be aliens close to the end or smthing...Â 
zSWdZVtXT7E,"""Not enough food""... riiiight. Today, we could feed twice the population we have. Each year we waste up to 2 billion tonnes of food. Wheres your screenplay now?"
zSWdZVtXT7E,Isn't the backing track from V for Vendetta? Evey Reborn?
zSWdZVtXT7E,This literally sent chills through my whole body. How amazing would it be to travel through a worm hole. I can only imagine......maybe one day. 
zSWdZVtXT7E,WORMHOLE. SOLD.
zSWdZVtXT7E,The best part is that this is all probably footage from just the first hour. Thanks for not spoiling anything and please keep it up
zSWdZVtXT7E,Yes. As long as it's a good time too.
zSWdZVtXT7E,"continuation of the species with anne hathaway onboard, what a dream..."
zSWdZVtXT7E,"How ironic to get this trailer as publicity when watchingÂ Dario Marianelli's ""Evey Reborn""Â (V for Vendetta).
Kinda dissapointed to not have heard an originalÂ soundtrack from Interstellar itself :-("
zSWdZVtXT7E,V for Vendetta!
zSWdZVtXT7E,Another Oscar for Matthew?
zSWdZVtXT7E,"Im surprised at the hate Nolan is getting, just by reading some of the comments, :o"
zSWdZVtXT7E,My best guess of the plot is that they invent some special kind of space/time travel which involves them going into stasis for a long period of time and when they wake up they find themselves somewhere they didn't expect and crazy stuff will happen. - best plot estimate ever!
zSWdZVtXT7E,Just me guys? but this trailer isnt amazing as I thought! but thats a good thing cause I know the film will be good
zSWdZVtXT7E,I can't wait to see the How it Should have Ended for this
zSWdZVtXT7E,wow this looks sooo good
zSWdZVtXT7E,That was dope! Bring on the McConnaissance!
zSWdZVtXT7E,Christopher Nolan's Alpha Centauri/Beyond Earth.
zSWdZVtXT7E,I'd love to come back in another 10.000 years time and see what we have achieved.
zSWdZVtXT7E,Bad movies really aren't Nolan's thing
zSWdZVtXT7E,Since True Detective i want to see absolutely everything with McConaughey in it. Nolan directing certainly helps. :)
zSWdZVtXT7E,Im feelin this trailer kna meeean?
zSWdZVtXT7E,This. Looks. Amazing
zSWdZVtXT7E,prequel to avatar???
zSWdZVtXT7E,I think that jassica chastain is the the girl from this trailer when she gets older at 1:40
zSWdZVtXT7E,sunshine meets contact?
zSWdZVtXT7E,the song remind me of V for Vendetta in God is in the rain sceneÂ 
zSWdZVtXT7E,"YEEEESSS The trailer tells us NOTHING about the movie's main plot, yet Alfred is there, Mathew is there, Anne Hathaway is there... and Nolan is there. Oh don't forget the name: Interstellar. I can't wait."
zSWdZVtXT7E,57seconds in batman impression
zSWdZVtXT7E,"its not cheesy and full of special effects

plus is has really good actors in it.

matt mcconaghey and relationship with his kids looks important...i think this movie will be awesome.

i can sense another academy nomination for matt..."
zSWdZVtXT7E,NOLAN HATERS please do not bother and stay on earth; BELIEVERS please have a seat and get ready for an INTERSTELLAR travel.
zSWdZVtXT7E,I don't really like this idea....just give up on Earth and ruin another planet? Okay?
zSWdZVtXT7E,anything is possible.. i don't believe this is a sci-fi movie. I believe interstellar travel will be reality one day
zSWdZVtXT7E,"looks good and interesting, not cheesy and unoriginal like prometheus or pacific rim.

matt mcconaghey really is the best actor in the world at the moment, good to see him front the movie."
zSWdZVtXT7E,I miss wally pfister's Cinematography :( ...
zSWdZVtXT7E,Total feels. This looks fantastic.
zSWdZVtXT7E,is that emma stone? :)
zSWdZVtXT7E,V for Vendetta Theme! :D
zSWdZVtXT7E,"Almost every film Nolan has directed has ended up one of my favorites, so I plan to see this day one. But at the same time, this trailer didn't really do anything for me."
zSWdZVtXT7E,"Not to be ""that guy"" here, but doesn't Jupiter look a little small when the ship is flying towards the rings? Like... scale-wise, Jupiter looks smaller than Earth. Unless the ship is hella far away but it looks like it's a lot closer. Who knows. We'll find out in November!"
zSWdZVtXT7E,Loving the V for Vendetta song
zSWdZVtXT7E,"Anyone recognized the V for Vendetta track from the trailer?

It's from when the police officer dreams V's plan with a hitch... It was a great scene."
zSWdZVtXT7E,Epic.
zSWdZVtXT7E,This movie.
zSWdZVtXT7E,I still have no idea what this film is about...
zSWdZVtXT7E,Can't wait to see
zSWdZVtXT7E,I kind off feel like crying now. :' Â )
zSWdZVtXT7E,awesome
zSWdZVtXT7E,The musical score is totally from V for Vendetta.
zSWdZVtXT7E,Movie of the year of course.
zSWdZVtXT7E,I can't wait to see this movie
zSWdZVtXT7E,"The sounds coming from Elon Musk house - ""fap, fap, fap""."
zSWdZVtXT7E,hmm..lets see..some movie guy decided lets take Space Cowboys and Armageddon and put them both together.Â  How original!Â Â  Is Hollywood serious here - that no one is going to be able to tell.Â  Im guessing its going to flop - then again people like this mathew mccaughna dude..so the reviews might actually be kind and get people to want to see it.Â  I've already seen it...in 2 different movies DOH!
zSWdZVtXT7E,"Enough with the label ""Sci-Fi""... interstellar travel will happen whenever we start thinking as a ""species"" rather than individuals... It's time to confront reality...Â "
zSWdZVtXT7E,this is the movie i have wanted someone to make my whole life and its by one of my favorite directors and starring one of my favorite actors. oh fuck yeah
zSWdZVtXT7E,Can't wait 
zSWdZVtXT7E,this preview gave away pretty much the entire plot of the story
zSWdZVtXT7E,So they are going into a black hole right ?
zSWdZVtXT7E,Toy Story 2 was ok
zSWdZVtXT7E,I am Sold !
zSWdZVtXT7E,Hopefully it won't be a huge disappointment like Transcendence. 
zSWdZVtXT7E,"OK is it just me, or did they just reveal at the end of the trailer he uses a blackhole'sÂ  gravitational pull to accelerate near/past the speed of light? I'm okay with that, as long as they don't travel through a blackhole/wormhole(that would be cheesy IMO). :D"
zSWdZVtXT7E,"Christopher Nolan Is the one and only person who can honestly make a sci-fi that will match up to 2001: A Space Odyssey, Fingers crossed that This Is It."
zSWdZVtXT7E,It's all an elaborate ruse to get Matthew McConaughey off the planet
zSWdZVtXT7E,"So, I watched this first on my phone, and then on the computer.

WATCH IT ON A LARGE SCREEN!!"
zSWdZVtXT7E,"Great, thanks for letting me know I have to wait until November to watch this. Lol"
zSWdZVtXT7E,Looks awesome. Â That's got to be the song from V for Vendetta
zSWdZVtXT7E,"They seem to have worked out the visual of the black hole very neatly.
I hope they remain consistent when they explain the physics.Â 
I don't mean ""realism"", it's SciFi, so just consistency in the physical explanations"
zSWdZVtXT7E,I'll certainly be waiting for Neil Degrasse Tyson to explain all scientific errors in this movie
zSWdZVtXT7E,Looking forward to seeing this one :D
zSWdZVtXT7E,did anne hathaway and her joker-like smile have to be cast in this movie. she is so smug and petty.
zSWdZVtXT7E,"The Trailer music is picked up from ""V For Vendetta"" , titled ""Evey Reborn""...& All I could picture while watching this trailer was a bald Natalie Portman :)"
zSWdZVtXT7E,"One day, we will go beyond this world"
zSWdZVtXT7E,I got chills. This looks amazing.
zSWdZVtXT7E,Ser bra ut!
zSWdZVtXT7E,2:05 looks like the end of the movie
zSWdZVtXT7E,I swear the music in the trailer is from V for Vendetta...
zSWdZVtXT7E,Can't wait
zSWdZVtXT7E,the wormhole was found after we dumped Chuck Norris' ashes in space
zSWdZVtXT7E,Epic SF is back in town....
zSWdZVtXT7E,Wow I thought I was watching a preview to the second season of True Detective in the first 5 seconds.
zSWdZVtXT7E,Nolan is the boss! Seriously waiting for this movie!
zSWdZVtXT7E,"Fuck you, Alfred! Go help Batman fight Superman!! "
zSWdZVtXT7E,So what is this about? They could explain the plot in the trailer?
zSWdZVtXT7E,Awesome!!!............can't wait to see this one. It will be superb like his previous movies for sure. Trailer gives just a glimpse of a plot and thatâ€™s really smart. I think Nolan will deliver the master piece in the world of space- time travel movies like we have never seen before on celluloid.
zSWdZVtXT7E,"Nolan!, you're my boy blue"
zSWdZVtXT7E,"That scene with the daughter is heartbreaking. I have a feeling the trip they are about to take is a one way ride. Movie looks fantastic, can't wait for it!"
zSWdZVtXT7E,concept resembles that of 2012 - leave this planet to go to another to survive doomsday on earth
zSWdZVtXT7E,7 nov? my god why so longÂ 
zSWdZVtXT7E,"Ah, smoke and mirrors, ya gotta love Hollyweird. Published yesterday, almost 2 million views and 14 thousand likes. By my calculations, that's almost 2,000 views a minute. I've been here and refreshed repeatedly and it's gone up less then 30 views in ten minutes. The one to say ""bullshit"" the loudest wins. What exactly *won't* people do for money?"
zSWdZVtXT7E,"""We weren't meant to save it. We were meant to leave it."" I hope this movie includes how wrong that is. Leave? Sure. Save? Definitely."
zSWdZVtXT7E,"one great thing about nolan movies are the carefully-placed clues in the trailers. they don't just show you the most exciting action/dramatic shots, they show you what you're supposed to think about before going to the theaters"
zSWdZVtXT7E,So in Nolan verse india on top? We cant get that aggressive. 
zSWdZVtXT7E,"Trailer was awesome,focussing more on family n relationships.
I think Cooper's(Matthew McConaughey) daughter Murph is Jessica Chastain in the future(redhead and she's wearing cooper's coat).So i guess the narrative will jump back and forth in time. Can't wait to see the movie.Â "
zSWdZVtXT7E,If he goes through the wormhole before the hour mark then color me interested. Â If the final scene of the trailer is the final scene of the movie then I pass.
zSWdZVtXT7E,"Music is from V for Vendetta. Was it from anywhere before that?
"
zSWdZVtXT7E,God is in the rain.
zSWdZVtXT7E,"Best picture 2015,Best actor Matthew McConaghy.Best Supportting actress,Best Director. Done. (Drops Mic)"
zSWdZVtXT7E,"Yeah um... if you are traveling into deep space to look for other planets, don't promise your kids you're coming back because you aren't. I hope Nolan studied up on physics and things like time dilation...Â "
zSWdZVtXT7E,Imagine this being only the first 10 mins of the movie - we are in for a ride !!!!!!!!
zSWdZVtXT7E,"McConaughey is gonna return to earth having not aged, but his daughter (now older) will wind up being Jessica Chastain and his son (also older) will be Casey Affleck. Nothing to back that up with but my brain :D"
zSWdZVtXT7E,This is about SpaceX and Elon Musk in a few decades.
zSWdZVtXT7E,"this is Sci-Fi movie who directed by Christopher Nolan and the soundtrack composed by Hans Zimmer.
I'm done."
zSWdZVtXT7E,wow
zSWdZVtXT7E,"the trailes events i think its just in the beginning of the movieÂ 
and looks inspired by 2001 Space Odessy"
zSWdZVtXT7E,"Matthew McConaughey getting movies left and right recently , after the dallas buyers club and wolf of wall street"
zSWdZVtXT7E,CGI's gonna blow my socks off
zSWdZVtXT7E,YEAH MICHAEL KANE IS IN THIS
zSWdZVtXT7E,"looks like another movie that gets off to a very slow and boring start and by the time it starts to get exciting, they are out of time and have to rush the ending or leave the ending out completely...less running around on a farm and hugging your kids andÂ MORE sci fi (with an emphasis onÂ applied science)Â and space and aliens!!! We get it you are a family man and love your kids, we dont need 90 minutes of it...I can almost feel the ending of this movie will be as bad as Contact or Misson to Mars...ugh"
zSWdZVtXT7E,So... orange..
zSWdZVtXT7E,"Tbh i really don't like this trailer. I'm sure the movie will be great, but they gave away too much, and i think the first teaser trailer did a much better job of getting me pumped to see the movie. Showing them in space was a mistake, they should have left that for the movie. I want to be wowed. Hope it delivers!!!"
zSWdZVtXT7E,â€œThe world doesn't need more engineersâ€ LOL more like the Â world has too many engineers. Besides that the graphics are beautiful
zSWdZVtXT7E,"I like how in this movie the depression/dust bowl (a future version anyway) and the interstellar space age are not decades, but mere miles apart. Â It kinda reminds you that the old always coexists with the new."
zSWdZVtXT7E,"all i can comment is ""cant wait to see it.' Nolan hasnt let me down and im sure there is no ""yet"""
zSWdZVtXT7E,"The beginning of this trailer is rubbish, what poor editing!"
zSWdZVtXT7E,Christopher Nolan was born on earth. But he was never meant to be worshiped here.Â 
zSWdZVtXT7E,collectivists
zSWdZVtXT7E,This looks like it can be a very beautiful story I hope it wont disappoint.
zSWdZVtXT7E,The music sounded like it was from V for Vendetta. When Evey is standing in the rain after her jail time.Â 
zSWdZVtXT7E,wtmotherfuck...i have been waiting and waiting. i know everything about this movie and this is ALL THEY SHOW....M.M. travels through a wormhole and that's it!!!!
zSWdZVtXT7E,It Looks Meh...
zSWdZVtXT7E,i want to watch it! now!
zSWdZVtXT7E,"type this in the youtube search bar wont regret it :
Afrojack - Dynamite (audio only) ft. Snoop Dogg"
zSWdZVtXT7E,"This kind of reminds me of ""Another Earth"". It's a sci-fi film where the focus isn't the sci-fi stuff, but just humanity.

Anyway, I don't believe humans can run out of food before discovering the technology to sustain everyone. We just need to get rid of money, religion, & other useless stuff, so we can focus on the most important things to furthering mankind's existence. All-in-all, I don't think it'll matter if we all did just die on this planet... we kinda think that we're way too special. As long as it isn't from Earth exploding, nature will do just fine without us... there are tons of life at the bottom of the ocean that can exist in space, heat, etc. They'll eventually, most likely, evolve into some other being like us billions of years from now."
zSWdZVtXT7E,What's the trailer song please.
zSWdZVtXT7E,This is the film I've been waiting for since I can't even remember.
zSWdZVtXT7E,"Too many people think about saving the world - mostly by fault of womens' egocentrism. The best way to improve the world around you which in turn improves your life is to work under the system you are located in and build your life there. Worry about yourself more than others' and focus on what you're doing. And remember, you're not always helping."
zSWdZVtXT7E,"I don't wanna close my eyes, I don't wanna fall a sleep LOL"
zSWdZVtXT7E,instant classic
zSWdZVtXT7E,Christopher Nolan = High Anticipation
zSWdZVtXT7E,"Fantastic ""V for Vendetta""-Score!"
zSWdZVtXT7E,"I know it's a very different story, but the fact that it's Matthew McConaughey in a movie that centers around space travel, (possible) wormholes, and a father-daughter relationship, kind of makes me really think of the 1997 film ""Contact"""
zSWdZVtXT7E,"Wow. This is what I love about Nolan. He can put a trailer out there that shows us what the film is somewhat about but still leave us craving a whole lot more. And that music only Hans Zimmer can create. Something tells me this one is going to be filled with a lot of emotion, especially for those of us that are parents since they are highlighting the father/daughter relationship. November can't come soon enough for me. "
zSWdZVtXT7E,"*am i the only one that thinks, wormholes are only possible through star gates sorta thing or omega relay's like mass effect , i don't believe in warp speed, or at least not for another 200-1000 years*"
zSWdZVtXT7E,Saw this trailer before Godzilla. It came out of NOWHERE. So excited for a real space adventure.Â 
zSWdZVtXT7E,It's look like an awesome movie... !Â 
zSWdZVtXT7E,"Its about climate change and humanity's last ditch attempt to survive and then FAILED horribly in the end. Humans are too stupid and evil to deserve this planet, just die already.Â "
zSWdZVtXT7E,Did Christopher Nolan wrote all his stuff at Starbucks?
zSWdZVtXT7E,Goosebumps!!
zSWdZVtXT7E,This is Matthews time to shine.
zSWdZVtXT7E,Cool! Nolan's the man!
zSWdZVtXT7E,Well it's about interstellar space travel. Lol. But the Prestige was about magic. Inception was about dreams. Ect. There's always a little more to his movies.
zSWdZVtXT7E,this trailer kinda reminds me of man of steel which fucking sucked. i hope this movie doesen't disappoint.
zSWdZVtXT7E,"Pretty obvious what the plot is.. ""..Nothing in the solar system can help us."" So they build a ship to fly to another universe/world system and see if there's anything there that can save Earth since physics in another universe may be different. Apparently they found a wormhole next to Saturn to travel there so yea.. I don't think it was meant to repopulate humans as you need a specific number to reproduce the species, and a few hundred isn't gonna cut it."
zSWdZVtXT7E,"Finally, a movie about Daft Punk's Interstellar adventure in sector 555.Â "
zSWdZVtXT7E,Not sure what this will be about....but it looks awesome. I trust Nolan. Hasn't let me down yet.
zSWdZVtXT7E,"Looks like we're going to be getting something on the level of 2001: a space odyssey or Contact in terms of ideas/ messages, themes, and quality of execution. Maybe even better, you never know what Nolan can surprise you with in his movies.

Judging from this trailer alone, ill definitely be watching when it comes out."
zSWdZVtXT7E,I have to see this movie
zSWdZVtXT7E,Space bubble ftw.
zSWdZVtXT7E,I think the first trailer was better.
zSWdZVtXT7E,Why is this only being shown in UK cinemas? :(
zSWdZVtXT7E,"I remember when ppl watched this trailer at IMAX, everyone was so quiet and focused til the end. Goosebumps everywhere. Can't wait! ðŸ˜Š"
zSWdZVtXT7E,Bravo!!! This looks like it's going to be a masterpiece!
zSWdZVtXT7E,November!! Ahh!
zSWdZVtXT7E,LOL! I swear Michael Cain is like the ultimate oracle or something; with every movie he makes with Christopher Nolan he always plays a character that is some sort of a guide to the main character and I have a feeling that's his role in this movie (which I have no problem with at all). It's just something I've noticed. I really can't wait for this one!
zSWdZVtXT7E,I just don't know if I can go back into space again after Gravity....
zSWdZVtXT7E,This could end up being a Nolanesque version of the Contact(1997) which also had McConaughey with Kip Thorne as scientific advisor.
zSWdZVtXT7E,"Aigh, aigh, aigh, I personally personally think we should take our shirts off before we go in this wormhole"
zSWdZVtXT7E,Who thinks Nolan should pull a Whedon and run DC Universe?Â 
zSWdZVtXT7E,Nolan is at it again!
zSWdZVtXT7E,everyone is dead by the time he comes back from that space travel lol.
zSWdZVtXT7E,reddit sent me hear
zSWdZVtXT7E,Fart
zSWdZVtXT7E,This looks really interesting but i can't help being distracted that the trailer stole the music from V for vendetta 'Evey reborn'
zSWdZVtXT7E,"Does he say ""Indian surveillance drone"" at 00:04??????"
zSWdZVtXT7E,Am i wrong or am i hearing the song from V for Vendetta? when Eve is standing in the rain?
zSWdZVtXT7E,I just can't wait.
zSWdZVtXT7E,"OK, so...what's happening to earth this time on this movie ???"
