Video ID,Comment
zSWdZVtXT7E,"This is just a trailer of the future, you know that right?"
zSWdZVtXT7E,"I'm getting a strong ""The Grapes of Wrath""+""2001: A Space Odyssey"" vibe here. I think the movie will be about Earth being unable to sustain life anymore due to overpopulation, pollution, and natural disasters which prompts humanity to venture into the universe in search of a new home.Â "
zSWdZVtXT7E,Pretty confused when I first saw the trailer and heard V for Vendetta's soundtrack.ï»¿
zSWdZVtXT7E,"The music on this is so powerful and emotive. Fits perfectly into the trailer, it's like a second storyteller."
zSWdZVtXT7E,"These comments are filled with presumptuous arseholes who are convinced they know everything about physics. ""It's a black hole,"" uhh no that destroys matter. "
zSWdZVtXT7E,"Nolan is bad or overrated?? he made two stunning masterpiece,who do you like? Bay?
you guysÂ focus on visuals way too much,it's like: 1-visuals,2-actors,3-plot.Â 
when it should be:1-plot,2-actors,3-visuals.
you are ruining both cinema and the gaming industry!Â "
zSWdZVtXT7E,"People who are hating on this are trolls of the highest proportion! 

Nolan is a genius "
zSWdZVtXT7E,Did they use the same space ship from The Last Starfighter?!!
zSWdZVtXT7E,I'm coming back.... (Save the world)
zSWdZVtXT7E,this looks like it is going to go along similar lines as Contact
zSWdZVtXT7E,We Chose to come here so actually we have to Heal this Planet. I Love Chris Nolan but I don't agree with the plot of this Film.
zSWdZVtXT7E,In Nolan We Trust 
zSWdZVtXT7E,Cool a new Christopher Nolan movie! Where's Joseph Gordon-Levitt?
zSWdZVtXT7E,v for vendetta?
zSWdZVtXT7E,ACADEMY AWARD WINNER MATTHEW McCONAUGHEY!!!
zSWdZVtXT7E,Sound of a glass sky at 1:56.
zSWdZVtXT7E,"Flat, lol!Â "
zSWdZVtXT7E,1:53 Jesus christ thats terrifying
zSWdZVtXT7E,"I guess when your all male strip club doesn't work out, going to space is the next best thing."
zSWdZVtXT7E,you know it is going to be good when Nolan is the director!
zSWdZVtXT7E,this is gonna b d best science fiction movie ever. Â Nolan direction and music by hans zimmer about black hole. Ooooh cant wait.
zSWdZVtXT7E,"The music sounds like ""eveys reborn"" from v for vendetta!"
zSWdZVtXT7E,It's a movie! If you want something more genuine go back to school. Why bother watching the trailer if it is such a waste of time. I find it most refreshing compared to other movies that are soon to be in theater. ..for instance TMNT.
zSWdZVtXT7E,"Oh no, I was looking really forward to this until I saw the kids.

Please don't let them have a lot of screen time..."
zSWdZVtXT7E,"finally some ""sci"" in an scifi movie again ... looks great"
zSWdZVtXT7E,"If the next ""2001"" is out there then this may very well be it. Remember that that all time classic was (& still is) one of the most misunderstood movies ever made. Nolan is THAT smart & uncompromising. McConaughey's last sci-fi film was the vastly under-rated & excellent ""Contact"" with Jodie Foster which is Robert Zemeckis's best film.Â "
zSWdZVtXT7E,"Near future, global warming, new dust bowls resulting in food shortages, mass migration, military control? And a crewed interstellar mission looking for what exactly? Help? A new home? I certainly hope this doesn't turn out to be a film all about the Dads promise to come home. From the trailer it looks like the daughter has grown up waiting for his return. And if you were sending a mission down a wormhole for the first time knowing it could be a one way trip, surely you'd send enough people to start over ...."
zSWdZVtXT7E,"The Dark Knight was Nolan's Masterpiece, don't compare this film with that Epic film, it's a space thriller along with the concept of Apocalypse, I guess"
zSWdZVtXT7E,Looks like albecurrie drive
zSWdZVtXT7E,"I hate this trailer to death, it gave away too much of the story, ruined it a bit for me"
zSWdZVtXT7E,I'm confused...
zSWdZVtXT7E,"I love that they borrowed a selection from the V for Vendetta soundtrack for this trailer. If anyone's bent out of shape over it, the main trailer for V for Vendetta also borrowed a great piece - Encounter from Klaus Badelt's Equilibrium soundtrack."
zSWdZVtXT7E,WHO ELSE GOT GOOSE BUMPSÂ 
zSWdZVtXT7E,"The trailer basically just shows the first half of the film. We dont see what happens when we he gets back. Â Casey Afleck and Jessica C. are his kids grown up. Â I think he finds a planet or a civilization, and this is just the beginning of us making the journety. Â Its not like 5 billion or going to get on a transport. He finds a planet....and human kind now has a new place to go."
zSWdZVtXT7E,This will be theÂ 2001 a space odyssey of this century.
zSWdZVtXT7E,Great! I'm loving it so far! It's almost like Star Ocean The Last Hope except there was no nuclear war and there's no advanced space ship and it doesn't seem like the worlds united.
zSWdZVtXT7E,"ripped off from star trek enterprise. this may well be nolans ""Signs"" and show shyamalan how to make a movie filled with stupidity. lol nolan, blandly going where others have boldly gone before."
zSWdZVtXT7E,Christian Nolan is one of the most stupidest movie makers ever. Inception is totally overrated and the dark knight was boring shit. He needs to learn how to make good movies from Michael bay. INTERSTELLAR looks like a copy of every other sci-fi movie. ugh this movie will bomb
zSWdZVtXT7E,I'm onboard ðŸ˜†ðŸ˜ŽðŸ˜ŽðŸ˜ŽðŸ˜Ž
zSWdZVtXT7E,"guy directed two movies apart with ""in"" in the beginning title as adjectives."
zSWdZVtXT7E,"Nolan is the best director of all time and I can't wait for this
"
zSWdZVtXT7E,Christopher Nolan? Matthew McConaughey? Hans Zimmer? How could I resist?!?!?!?!
zSWdZVtXT7E,I can not wait for it .. :-- )
zSWdZVtXT7E,I hope this movie focuses more on the science fiction rather than the dramaÂ 
zSWdZVtXT7E,"This will end in a paradoxical time loop.
The protagonist will unknowingly fly back in time and land on earth 200000 years in the past, have sex with lovely apes and his copilot and be founder of humanity as we know it. ;)"
zSWdZVtXT7E,I need it.......... so badly.
zSWdZVtXT7E,The title seems familiar to daft punk anime movie called Interstella 5555...
zSWdZVtXT7E,6/10. Won't waste money on going to the cinema for but a rental is worth it.
zSWdZVtXT7E,I am coming back. In Space time :)
zSWdZVtXT7E,And let all the stupid movie critics comment start!!
zSWdZVtXT7E,I believe that there father (Matthew) went through a worm hole and the young girl (Murphy) grows up and that's Jessica Chastain and Casey Affleck is the oldest son and I believe there father hasn't came back in many years ... 
zSWdZVtXT7E,This looks great! I would expect nothing less from Christopher Nolan. 
zSWdZVtXT7E,"This trailer is very reminiscent of 2001: A Space Odyssey - the space suits, hibernation capsules, scenes with spacecraft in space, and ambient intensity to name a few. "
zSWdZVtXT7E,"I think it will be a smart movie, specially because Jip Thorne is involved ( a famous Scientific with works about worm holes) I guess it will have a lot of jump of timeÂ a la Inception, but Time travels instead Dream layers. The thing I disagree is that apparently humans destroyed Earth, and now they are going to other place, this does not have anything to do withÂ  the main theme of Interstellar first trailer. In that one, human wante to discover the unknown. Now, they have to move to anotherplace becasue their home is wasted (by them). Also, if you travel trough a worm hole the time changes, so, what is the point to travel there if when you come back to earth, a lot of years have passed by?? It is no easie trying on mars?? IT is not easier trying to save Earth?? If you could fly close to Saturn so fast, could enter inside a Worm Hole, maybe you could have some ways to save Earth or install Mars Colony."
zSWdZVtXT7E,God is in the rain.
zSWdZVtXT7E,"i'm guessing in this movie Matthew doesn't return from his mission and his kids grow up and succeed. I hope it isn't that predictable. Like someone else said,Â Â Jessica Chastain's character is wearing the same jacket as Matt's in the beginning and the trailer seems to focus an awful lot on the kids."
zSWdZVtXT7E,"as big supporter and fan of space exploration related things, I would surely watch this.Â 

hell, I might even boot KSPÂ as wellÂ  and watch some NASA videos, this got me pumped up"
zSWdZVtXT7E,Matthew McConaughey for Doctor Strange!! What you think?!
zSWdZVtXT7E,total starship troopers rip off
zSWdZVtXT7E,"Alright, alright, alright..."
zSWdZVtXT7E,WANT!
zSWdZVtXT7E,"Warning!Â 
To completely and understand the movie and its plot it is required a Phd. in the following areas: Physics, astronomy and philosophy."
zSWdZVtXT7E,"Haven't looked forward to a movie as much as this in a while. Please don't screw this up!! I doubt they'll actually make a return journey in-movie and let us all know what happened but I find the plot itself extremely interesting. From what I can tell the swirling black ball looked like some kind of wormhole (generic, I know) but I love the detail of the outer edge swirling around the still center, almost like an accretion disk around a black hole's event horizon. This movie could be amazing or horribly, horribly awful."
zSWdZVtXT7E,they should have used the teaser trailer's music. Hans Zimmer ftw!
zSWdZVtXT7E,"This is my latest favorite trailer because it is using Evey Reborn as the song, and I must say, it worked well with it."
zSWdZVtXT7E,0:01 valorie curry??... Â 1:32 anne hathaway and casey affleck o west bentley??..i think.
zSWdZVtXT7E,The beginning of Man of Steel only from Earth.
zSWdZVtXT7E," 
I wish this film the best of success. I hope it opens up a serious debate about our declining resources, our environment, and our survival as a species. However, here is a question. Why in the trailer (and I strongly assume in the film) there is technology that can help a spaceship travel at those great distances in space, but no technology that can reverse hunger, climate change, etc?ï»¿
"
zSWdZVtXT7E,"Even though I generally liked the movie, this better not end like Contact.Â  But anyway, being an astronomy nut I am extremely excitedÂ for thisÂ movie."
zSWdZVtXT7E,What a great movie
zSWdZVtXT7E,"Anyone hating on Nolan and any of his movies, Including inception which was a cinematographic masterpiece, is a half witted moron who knows nothing about film."
zSWdZVtXT7E,I can already feel the feels..
zSWdZVtXT7E,This film gonna be epic!Â 
zSWdZVtXT7E,"#interstellar, looks good, but, 'NOVEMBER, really!!!!!!!' "
zSWdZVtXT7E,"Could turn out to be like any of his other recent movies, people will bow before this movie when it comes out but soon after it'll be cut up and over analyzed. I'm excited for it though, shows tons of promise."
zSWdZVtXT7E,True Detective meets Orbital.Â 
zSWdZVtXT7E,
zSWdZVtXT7E,can't wait to see it!
zSWdZVtXT7E,This looks awesome :)
zSWdZVtXT7E,"""Ok, we're facing massive climactic change. Should we either use known, proven hydroponic technologies en-masse to confront this issue or instead base everything on taking a shot at hurling a small crew through a wormhole we don't understand to see if maybe an inhabitable planet is on the other side?"""
zSWdZVtXT7E,Its funny how all the critics think they know it all when they forgot the one critical aspect of movies is that its just a movie ! Entertainment dumb asses 
zSWdZVtXT7E,
zSWdZVtXT7E,This trailer gives me the shivers... This is suppose to be a drama but i get more thrills than anything else
zSWdZVtXT7E,Warp travel!! WOW
zSWdZVtXT7E,"Evey reborn, best thing to come out of the V for vendetta film."
zSWdZVtXT7E,"Looks very interesting, though ultimately I see humans repeating their same mistakes no matter where they end up on : neglecting their planet till it's too late to then look for an other one and so, the vicious cycle goes on. Pessimistic, I know.Â "
zSWdZVtXT7E,"Some analysis. 1:40 , the chick looks like the daughter all grown up. 1:54 , they enter an event horizon, where theoritically, time slows down. I'll bet that the plot goes along the lines of Mcconaughey getting trapped. When he gets out, what feels like only a little while, turns out to be several years.Â "
zSWdZVtXT7E,"National Geographic had something similar ""quasar headed for earth"" humans had 50 years to construct a World ship to leave our solar system. "
zSWdZVtXT7E,"8,001st comment? "
zSWdZVtXT7E,"One thing i'm really looking forward to is seeing what kind or universe Nolan plans or ""planed"" to make, and that hopefully it doesn't show too much of earth. I really love it when his movies hang with the ""out there."" I know i will feel slight disappointment if it shows the main goal of the story at the end."
zSWdZVtXT7E,"I didn't know trailers were supposed to spoil the film.

So, Jessica Chastain is obviously adult Murphy. The ship/crew went through some kind of time warp, was unable to communicate with Earth and everyone was presumed dead. The crew (less a few members) came back at nearly the same age as they left while everyone on Earth aged 20 years.

Thanks, trailer.

Best guess is that the ""New Earth"" they find is actually very old, pre-human Earth and the survivors go there to live and try to change the path Earth takes toward desolation."
zSWdZVtXT7E,"Once it's not full of mindless robots fighting eachother, gallons of gasoline blowned up, dramatic action scenes or ""from the beggining to the end"" obvious plot, most of these ""critics"" tend to bitch about the movie all day long. Pathetic.

I bet most of you never saw a single movie from Bergman, Tarkovskij, VlÃ¡Äil or anyone outside Hollywood. For me,Â Interstellar has an appeal for Nolan's best movie to date (although I love The Prestige). Stunning visuals, attempt for something else than stupid blockbuster and (I hope) honour to the best sci-fi pieces such as 2001: Space Odyssey.

Just wait for your brainless Transformers: Zillionth Sequel, that's the title you are looking for."
zSWdZVtXT7E,"This Film is going to be awesome. You people should have faith in Nolan, and to those who don't like him why are you even commenting.Â "
zSWdZVtXT7E,Soundtrack -Â Evey Reborn - Dario Marianelli
zSWdZVtXT7E,I have a feeling there's a lot more to this movie than what's in the trailer.
zSWdZVtXT7E,ONE QUSETION- IS THAT SPACE SHUTTLE RUSSIAN MADE?
zSWdZVtXT7E,Looks AWESOME.
zSWdZVtXT7E,"What is the song that is playing in the background? Sounds vaguely familiar, from another movie scored by hans Zimmer perhaps?"
zSWdZVtXT7E,"It's encouraging to see Nolan deal with actual human issues rather than moralistic (superhuman) ones. This is the inevitable outcome of the collective ""us"". How we act as we outgrow out planet will define us as a species. I wonder if the general public is ready for these outlandish ideas. Better buy two popcorns just to be safe.
Â "
zSWdZVtXT7E,Damn the soundtrack is amazing.
zSWdZVtXT7E,"V for Vendetta's soundtrack...
"
zSWdZVtXT7E,Who is the female actor at 1:52 ?
zSWdZVtXT7E,Haven't been this excited about a film since Prometheus. Really hope it delivers...
zSWdZVtXT7E,Looks Awesome.
zSWdZVtXT7E,Is this the sequel to Contact? Where is Jodie Foster?Â 
zSWdZVtXT7E,Mackenzie Foy is such a great actor <3
zSWdZVtXT7E,Im coming back...CHILLS!!!!!!!!!!!!!!!!!!!!!!
zSWdZVtXT7E,can't wait
zSWdZVtXT7E,Please. Let this be not more of Europa Report and better thanÂ Gravity.
zSWdZVtXT7E,"The women that appears in the 1:40 minute most be the grown up main characterâ€˜s daughter murphy, or maybe her mother but that dosnt would make any sense to me.

Pd. Sorry for my english."
zSWdZVtXT7E,Haters everywhere... Â Idiots started to criticize the film with this 2:54 min trailer
zSWdZVtXT7E,Looks like Alfred's stepped up in life since he worked for Batman...
zSWdZVtXT7E,This movie looks good :) btw is that the girl from twilight ?
zSWdZVtXT7E,this will be the best movie this year so transformers kids can go away cuz they wont like it xD
zSWdZVtXT7E,It appears that many here who have not experienced adversity cannot relate to a masterpiece portraying people who come together to overcome it.
zSWdZVtXT7E,i bet the movie ends like it ends in the trailer! would be so freaking bad -.- now if the movie had a continuety to it a universe of it's own wil alot of story telling that would be awesome!
zSWdZVtXT7E,"For everyone saying that this is Hanz Zimmer, it's actually Evey Reborn by Dario Marianelli..."
zSWdZVtXT7E,i never once in my life thought i would one day see how the cosmos looked when we warped through space bending it......as a cosmology fan i thank you for showing me this luminous and didacticÂ masterpiece.Â 
zSWdZVtXT7E,wow the girl really look like Anne Hathaway.
zSWdZVtXT7E,"To those asking about the music in this trailer, it's a track from the movie V for Vendetta; the track is called Evey Reborn byÂ Dario Marianelli."
zSWdZVtXT7E,I think he's not coming back. It's Chris Nolan's film ladies and gentlemen! I can't wait for it!!!!!
zSWdZVtXT7E,"This is not the film we deserve, but the one we need.
I'm not sure I've ever been so excited for a movie, this trailer speaks to me on many many levels."
zSWdZVtXT7E,YAY! Looking forward to this one :D
zSWdZVtXT7E,"Really excited for this, finally a sci-fi movie about space that will be both good and realistic. Cannot wait."
zSWdZVtXT7E,holy mother of all three dragons
zSWdZVtXT7E,the song is from V for Vendetta..
zSWdZVtXT7E,"The Dark Knight - Universe
can't wait!"
zSWdZVtXT7E,"The plot is about the human race moving forward as in reality earth cannot be our only home. This movie is talking about when the time comes the human race needs to find another home. Earth wont be our only home otherwise we would all die, this is what this movie is about and I cant wait too see it."
zSWdZVtXT7E,"For all of you about to comment that ""this is clearly going to be a horrible movie because"" whatever, let me just point you to a movie similar to this. Doesn't have the same plot, but it does have the same pace (at least from what I can tell). There's a little movie out there made in the late 90's called ""Contact""."
zSWdZVtXT7E,Music: Â EVEY REBORN - DARIO MARIANELLI
zSWdZVtXT7E,this looks pretty boring tbh. christian nolan is a really overrated director.
zSWdZVtXT7E,Just got news that everything in this trailer is from the first 1/3 of this movie! There are no scenes in this trailer from acts 2 or 3. That just makes me so much more excited!! Â 
zSWdZVtXT7E,People need to shut their mouth. It's not even released yet and people are saying its flop. What they know about this movie because you can not get a single hint of how the plot is and what's its going to be like?Keep ur hatred away and wait for the movie!Don't try be smart ass when you know you are not!
zSWdZVtXT7E,"THERE IS A LOT MORE to this movie than what the trailer shows.

Nolan is good about hiding things."
zSWdZVtXT7E,"The whole family drama really ruins movies where there is a message trying to be delivered, like it did in Godzilla and World War Z. I know they're trying to target a larger audience and since I'm not a parent I wouldn't really understand the significance, however it usually always diverts the plot from the more important aspects of the film."
zSWdZVtXT7E,Is that a wormhole or a black hole at 1:55??
zSWdZVtXT7E,Christopher Nolan likes Baseball.
zSWdZVtXT7E,"These dis liker don't know nothing do you think Nolen care about you guysÂ 
Nolen gave a blockbuster convinced the producers and is started doing good film Â  Â  Â i Â mean a pure movie not considering the factor of successÂ 
He and Depp are the true movie lovers They doesn't care about flops and they would be only Appreciated only after their death like bob and che
guys wake up and prove that we are fit to live here and don't say that interstellar is a great movie after 10 years and price movie like Avengers and Hollywood would start only taking action movies Â  Â "
zSWdZVtXT7E,"Looks like another great film from Nolan. Â I've been on his bandwagon since I saw Memento in 2001 (I would see his first film, Following, years later) and I honestly don't think the man can make a bad film, or at least hasn't so far. Â I just don't think its in his genes. Â His box office worst, The Prestige, is actually one of my favorites."
zSWdZVtXT7E,this looks interesting
zSWdZVtXT7E,This movie's gonna be sad. Not just because of the story. But because it's true that one day we'll have to leave our beautiful home.  :(
zSWdZVtXT7E,"Anyone who is being negative about what is in this trailer clearly do not know how Nolan does his pre release PR. He never ever releases the full plot for any of his movies and the trailer is more often than not a small by-product of the larger picture.

Interstellar will be amazing!Â "
zSWdZVtXT7E,"I'm looking forward to this. It's like Hollywood read my mind. I am fascinated and completely obsessed with interstellar travel. If we can't actually do it, then Hollywood is the next best thing!"
zSWdZVtXT7E,Why does Casey Affleck always sound like he is out of breath??
zSWdZVtXT7E,"Maybe the woman in 1.41 would be Murphy in future.Â 
Look at her cloth you'll see is the same of Cooper."
zSWdZVtXT7E,Music sounds awesome... i presume it's Hanz Zimmer again.
zSWdZVtXT7E,The music is just sublime.
zSWdZVtXT7E,"The song is in V For Vendetta, which is a fantastic movie"
zSWdZVtXT7E,For all of you talking about black holes; this is not what you saw in this trailer. What you saw was a wormhole. There is a big difference between those two things.
zSWdZVtXT7E,"Music : Dario Marianelli - Evey Reborn, from the movie V For Vendetta."
zSWdZVtXT7E,Nice wormhole!
zSWdZVtXT7E,And thus begins the tale of John Crighton.
zSWdZVtXT7E,"$1 billion+ in the worldwide box office and nominations for Best Picture, Director, Actor in Leading Role, VFX, Cinematography, and Best Original Score. You heard it here first."
zSWdZVtXT7E,"This looks amazing, and what was the name of that song!?"
zSWdZVtXT7E,The soundtrack of the trailer is from V FOR VENDETTA (Evey's Reborn) Thanks
zSWdZVtXT7E,This is my fav!
zSWdZVtXT7E,"I'm going to go ahead and put it out there that the music used in this trailer is not from this film, nor is it Hans Zimmer. It isÂ Dario Marianelli's ""Evey Reborn"" from the V for Vendetta soundtrack.

Despite it not being a part of Interstellar's soundtrack, it's still a great choice of music for the tone of this trailer, and I'm anxious to hear what Zimmer has written for the film."
zSWdZVtXT7E,that music ! <3
zSWdZVtXT7E,"I'm going to be really upset if the entire movie is them preparing to go on this mission but then you don't ever get to see them make it to another planet or anything, and they just end up dying in space. "
zSWdZVtXT7E,People who have read leaked versions of the script said that this is closer in comparisson to 2001 than the heavy-action Inception.
zSWdZVtXT7E,Trailer doesn't look like Nolan to me... lets hope it's like Heath Ledger with the Joker
zSWdZVtXT7E,"This is going to be amazing... has anybody noticed that this ""official"" trailer is actually NOT in HD??"
zSWdZVtXT7E,supposedly this song isnt actually zimmer. also didnt notice the older red head was wearing that jacket. makes me think of a multiple timeline plot similar to inception where we see cooper in another dimension (future) and murphy grown up waiting for him..the son too for that matter. with nolan involved you can almost assume there will be a plot twist involving time travel/kids/sacrifice?
zSWdZVtXT7E,I've been waiting for a new sci-fi film like this in a while (I'm not elitist about sci-fi but I'm a great fan of harder SF).
zSWdZVtXT7E,"That music is from ""V For Vendetta."""
zSWdZVtXT7E,"Haha, Nolan just loves using Michael Caine!"
zSWdZVtXT7E,I've watched this trailer 15 times now and I still get goosebumps every damn time.
zSWdZVtXT7E,Christopher Nolan- should let Neil deGrasse Tyson be his adviser on anything that the movie involves in space. Gravity came out last year and Dr Tyson labeled too many Scientific problems that were wrong with the movie. Just a heads up if you really want to make your movie perfect.
zSWdZVtXT7E,"""In the future, governments and economies across the globe have collapsed, food is scarce, NASA is no more, and the 20th Century is to blame. A mysterious rip in spacetime opens and it's up to whatever is left of NASA to explore and offer up hope for mankind.""

Great premise, its a real one we face today if our government continues to devalue the world's most important industry driving innovation and progress which drives our economy (and therefore the global economy)."
zSWdZVtXT7E,OST is same as used in V for Vendetta
zSWdZVtXT7E,Huh?? We don't have the technology to travel around in our own solar system never mind to distant stars. Why didn't they just move this story 100 years into the future.Â 
zSWdZVtXT7E,Can't wait
zSWdZVtXT7E,I'm not sure what to think about that movie...
zSWdZVtXT7E,I almost lost faith in humanity when reading the comments but judging by the likes to dislike ratio on this video I realize that those are just the idiots in the minority with big mouths.Â 
zSWdZVtXT7E,"Okay, so the preview gave away the movie.. But the aliens on this other world, I think they are going to be JAR JAR BINKS STYLE characters"
zSWdZVtXT7E,THIS SONG IS FROM V FOR VENDETTA!!!!!!!!!!!!!!!!!!!!!!!!!!!!!!!!!!
