Video ID,Comment
AST2-4db4ic,It’s time to put the book in the freezer joey😂😂😂
AST2-4db4ic,This movie is already ruined because of cuz of 90s sitcom show “Friends”😂
AST2-4db4ic,I AM CRYING!!!! I AM CRYINGGGG
AST2-4db4ic,Who are here just because of Emma likeee
AST2-4db4ic,Rachel already spoiled the ending 😑
AST2-4db4ic,"3 Words. Joey, Rachel and Friends."
AST2-4db4ic,At 12 I had my first otp Jo and Laurie and now watching this trailer I got the feels again
AST2-4db4ic,Is racism prevalent in this movie?
AST2-4db4ic,HARD PASS
AST2-4db4ic,I only know as much of Little Women as Joey Tribiani.
AST2-4db4ic,This looks awesome 👍👍👍👍
AST2-4db4ic,Am only going to watch it cause I love hermione
AST2-4db4ic,Saoirse Ronan is coming for her 4th Oscar nominated
AST2-4db4ic,Tbh I usually find little women really irritating and soppy but this actually looks pretty decent
AST2-4db4ic,Is there seriously no new movie ideas in Hollywood???
AST2-4db4ic,"Little girl with little prettiness,come soon,we love you Sony pics..."
AST2-4db4ic,Meryl Streep is in the house!!
AST2-4db4ic,Okay but what a gorgeous piece of music.
AST2-4db4ic,She marries the old guy because the author was in love with her dad's friend in real life.
AST2-4db4ic,This looks so dead boring...
AST2-4db4ic,Do we need another one??
AST2-4db4ic,What cracks me up is I read the book (and fell in love with it ) because of Friends 😅
AST2-4db4ic,I got my Christmas plans now
AST2-4db4ic,You go see a movie you just supported pedophilia and child trafficking and adrenochrome drinking and hollyweird
AST2-4db4ic,"WOW! A FEMALE LEAD?!

TAKE MY MONEY!"
AST2-4db4ic,Why is it so sad that this is all still relevant. All of the stuff being said has been said to me even today.
AST2-4db4ic,Barf
AST2-4db4ic,:/  hmm.....    I think I'd much prefer the 1949 version.    The marketing direction has already turned me off from what could otherwise be a fantastic adaptation with this amazing cast.
AST2-4db4ic,If I keep reading. Beth's gonna die...
AST2-4db4ic,"Saoirse Ronan nice to meet you on my favorite person Jo, you got it!!!"
AST2-4db4ic,"☆ωσωω ℓσvє∂ iτ cαท'τ ωαiτ ƒσr τнє мσviє τσ cσмє συτ ℓσvє yσυ sσ мυcн єммα yσυ αrє єммαʑiทg
☆"
AST2-4db4ic,"I might be in a very very very small minority but Chalamet's Laurie isn't doing much for me, idk why, he's just coming across as suave and whiny at the same time...I hope the movie does well, Saoirse as Jo and Florence Pugh as Amy is quite literally a coup, they are perfect."
AST2-4db4ic,I really wish the ending was different for this classic story.
AST2-4db4ic,"Whoever watched friends, already knows the ending 🤭😂😂😂"
AST2-4db4ic,It's gonna be tough to beat the one starring Winona Ryder but this trailer is stunning in every way. Can't wait.
AST2-4db4ic,yeeEEEEEEEEESS YES YES YES
AST2-4db4ic,another trash movie with feminist content. *disappointing*
AST2-4db4ic,This looks incredible
AST2-4db4ic,i smell oscars
AST2-4db4ic,"I was about to skip this one.
Then I saw Timothee Chalamet in the trailer.....

I STOPPED"
AST2-4db4ic,Gross. Emma Watson is involved.
AST2-4db4ic,Emma cant act  tho! Bye Herman!
AST2-4db4ic,Emma Watson is so desperate to be Kirsten Dunst..It's pathetic.
AST2-4db4ic,Little WOKE women.  I vomit.
AST2-4db4ic,"Ehhh... the 90’s version still wins out in my opinion, but timothlee is very hot in period clothes xD"
AST2-4db4ic,The actors picked seem perfect but personally I loved the 1994 remake and I really hope this one lives up to or surpasses. Putting my faith in Greta that all will be well.
AST2-4db4ic,EW + SR?! Wow!!!
AST2-4db4ic,it's gonna be hard taking the 1994 cast outta my head but am excited for this one
AST2-4db4ic,Greta Gerwig did it again
AST2-4db4ic,Emma♥️ Timothée ♥️♥️♥️ Meryl Streep♥️♥️♥️
AST2-4db4ic,Living back the childhood days😍 best feeling ever
AST2-4db4ic,I was thinking midgets for a moment
AST2-4db4ic,"Only reason I know this, because of Friends, when Joey reads Rachel’s book"
AST2-4db4ic,"Holy crap, this looks fantastic!"
AST2-4db4ic,Florence as little Amy might make me like her for once lol.
AST2-4db4ic,wait though are they gonna have Professor Bhaer? I love female empowerment queen Jo but like... should I expect my OG little women? or are they putting their own spin on it?
AST2-4db4ic,So extremely excited for Greta Gerwig’s 2nd movie as the leading lady in charge (Director). Everyone is buzzing about the actors but I’m all her for Greta.
AST2-4db4ic,Nice
AST2-4db4ic,Everything me being so excited about the actors. But the actor isn’t the one who makes the film the director is. My all time fav 2 actors are in this (Saoirse + Timmy). But I’m more enthusiastic about Greta Gerwig who is such a fabulous female writer and director and it’s. She has already accomplished so much with her first film and is hopefully ready for more great accolades in her career.
AST2-4db4ic,Desperate waiting!
AST2-4db4ic,"I think Greta Gerwig will be like Wes Anderson in the future, getting these crazy casts for every movie."
AST2-4db4ic,Excited 😬❤️
AST2-4db4ic,I wish this movie will in Vietnam 🇻🇳
AST2-4db4ic,imo the movie with Winona Ryder was done just fine...hate when they keep redoin the same movie.
AST2-4db4ic,More feminism garbage
AST2-4db4ic,1994 version best version
AST2-4db4ic,Do we really need a retelling of this?  Are we completely out of original ideas?
AST2-4db4ic,"Oh, I can just hear the SJWs screeching now. No POC or LGBT. Last I check it one of the best selling novels of all time. Written for and about women. So, I would hope that would count for something."
AST2-4db4ic,So in the movies the democrats push for independence but in politics they push for socialism???
AST2-4db4ic,"0:37

Why do I find that nod by Saoirse so attractive wtf 😂"
AST2-4db4ic,Saoirse Ronan keeps making the right choices.
AST2-4db4ic,Winona Forever!
AST2-4db4ic,"LOL, with this trailer i dont need to see the movie."
AST2-4db4ic,"""well youre not married""
""well that's because im rich""

that's going to be me a decade from now 😂😂"
AST2-4db4ic,Yay white people
AST2-4db4ic,Does anyone know what song or songs are playing in the background I recognize them but can't figure it out!
AST2-4db4ic,Not seen this but for me the Little Women with Wynona Rider and Kirsten Dunst and Susan Sarandon will forever be my favourite because it's the one I grew up with. For me when I read the book those are the faces that I see.
AST2-4db4ic,How many times are they going to remake this tired old movie?
AST2-4db4ic,Maybe if I watch this adaptation of the book...I'll be able to understand the book itself.
AST2-4db4ic,This looks very well acted and the cinematography is stunning!
AST2-4db4ic,*I can’t wait to fall in love with Timothee Chalamet all over again*
AST2-4db4ic,Emma watson 🥰
AST2-4db4ic,Another generation of little women. My favourite was with Claire Danes. Best death scene ever for this story hands down.
AST2-4db4ic,Nostalgia! 😍
AST2-4db4ic,"Unless I'm seeing things, why did they make Beth look younger than Amy? Beth is older than Amy."
AST2-4db4ic,Looks boring
AST2-4db4ic,I smell Oscar!!
AST2-4db4ic,"I hope this movie get nominated for Oscars, that's the only way I get to see this movie in movie theater."
AST2-4db4ic,SWEET MOTHER OF ALL VIRGINS I LOVE THIS ALREADY
AST2-4db4ic,"But....we already have a great Little Women movie with Claire Danes, Wynona Ryder, Susan Sarandon, etc..."
AST2-4db4ic,Umumumumumum. Everyone helps out a petition to help get rid of the CEO that's ruining this platform  Um boring.
AST2-4db4ic,"Cool, so I'm already crying and it's just the trailer. (My gosh I cannot wait to see this adaptation.)"
AST2-4db4ic,Florence Pughs agent has been busy
AST2-4db4ic,"I think this story is coming out in a really great time where women empowerment is at its highest and needed. My school did a phenomenal play based on the novel and the author was very ahead of her time realizing that women are more than beautiful brides they’re smart,courageous,creative and so much more!"
AST2-4db4ic,"This is definitely going to be a box office smash! 😐


😆🤣😆🤣"
AST2-4db4ic,My school did a phenomenal play about this last year and I’m very excited to see it as a film now!
AST2-4db4ic,Why do people love Timothy so much? You can’t be a feminist and support someone who works with woody Allen. 💁🏻‍♂️💯
AST2-4db4ic,This looks absolutely amazing! Does anyone know what songs they used in the trailer?
AST2-4db4ic,Why is no one talking about the wonky accents? Theyre all over the place. Emma Watsons accent slip was really obvious. Or maybe im just hyper sensitive to it because I watch a lot of movies form different countries idk.
AST2-4db4ic,I really want to see it!! Omg it's my girls!
AST2-4db4ic,"I'm sorry, but Tim will always be Elio to me."
AST2-4db4ic,WORST CINEMATOGRAPHY!
AST2-4db4ic,Saoirse Ronan as Jo? Emma Watson as Meg? Sign me up! I can't wait to take my mom to see this. Little Women has been something we've bonded over since I first read the books when I was in school.
AST2-4db4ic,this will be the most powerful feminist movie of the year and i can't wait to be empowered!! ♡
AST2-4db4ic,"AHHHH😆😆!! So excited for this! At any given time, the world can always use another Little Women movie..."
AST2-4db4ic,"Garbage..horrible cast , especially tired Meryl Streep  always getting her face into everything..so overrated!"
AST2-4db4ic,“Friends” spoiled me this movie more than a decade ago.
AST2-4db4ic,How many times does this movie have to be re made? Seriously. We get it..they're tough women living in another Century...who cars already
AST2-4db4ic,I like the one with Christian bale
AST2-4db4ic,Why does it look like its been recorded with a cheap point and shoot camera from the early 2000's? lmao
AST2-4db4ic,I love timmy tim！！💓💓
AST2-4db4ic,The 1994 adaptation is my favourite.
AST2-4db4ic,This looks amazing! Can’t wait to watch it!
AST2-4db4ic,Why are they always in films together?
AST2-4db4ic,I can’t b r eath e
AST2-4db4ic,Anybody knows the music score the are using throughout this trailer ?
AST2-4db4ic,How the hell is it that Timothee Chalamet has the power to make us fall in love with him every time?
AST2-4db4ic,We'll see if it beats the one with Winona Ryder. That's my favorite version.
AST2-4db4ic,"Timothée and Saoirse 
omg i’m blessed"
AST2-4db4ic,"I'm completely sold from the moment I see ""Little Women"" title. No more explanation. I don't even need to watch the trailer because I know this story by heart. My most favorite novel, the one that opened my passion for literature. ❣️❣️❣️

Nah, of course, I'll watch the trailer. Saoirse and Emma are there. It's a sin not to watch. RIP play button."
AST2-4db4ic,saoirse ronan’s oscar is coming
AST2-4db4ic,Meryl and Timothee?? I’m in. Plus I liked the book😁
AST2-4db4ic,Yesss can’t wait
AST2-4db4ic,"Is it just me, or would Timothee and Emma (Meg and Laurie) make a cuter couple?"
AST2-4db4ic,You had me at Streep and Pugh!
AST2-4db4ic,How many times is have they remade this stupid movie?
AST2-4db4ic,IM ACTUALLY EXCITED FOR THIS ADAPTATION
AST2-4db4ic,Looks like another great performance from Saoirse Ronan
AST2-4db4ic,Is this a movie for ANTS?!!
AST2-4db4ic,With this cast how could it fail?? I'm so excited <3333333
AST2-4db4ic,the color grading is unreal just like in Lady Bird... can't wait for this!!
AST2-4db4ic,Noooo
AST2-4db4ic,HERE WE GOO BITCHESSSSSS
AST2-4db4ic,yts am i right
AST2-4db4ic,timmy stans come get yalls juice!!! the drought is over!
AST2-4db4ic,"That's not how I imagined Jo at all, but I still want to see it"
AST2-4db4ic,Oh my. This is incredibly exciting.
AST2-4db4ic,"That harp piece at the start is
Wawa by the Ocean by Mary Lattimore"
AST2-4db4ic,"12 And, behold, I come quickly; and my reward [is] with me, to give every man according as his work shall be.Time to live righteous like in the olden days and come to Jesus."
AST2-4db4ic,This is sure to have some annoying wokeness.
AST2-4db4ic,i clicked for Emma Watson
AST2-4db4ic,Saoirse and Timothée as Jo and Laurie are so perfect together.
AST2-4db4ic,"I'm sure it will be a wonderful film, but HOW MANY TIMES are they going to tell this story on film??? There have been SO many adaptations of it on the big and small screens that I'm surprised the studio agreed to do another one. Greta Gerwig is an amazing writer and director. Why would she want to do something that's been done almost two dozen times?"
AST2-4db4ic,I hope they don't waste away such a gem of a cast and story. High hopes from this one🤞
AST2-4db4ic,I hear Oscar bells.
AST2-4db4ic,"Honestly, I would prefer to see Emma as Jo :("
AST2-4db4ic,"Looks like it also has the fun parts, and Saoirse, a must see.
I want the BluRay already."
AST2-4db4ic,A perversion of a great classic they shouldn't have even called it little Women
AST2-4db4ic,Still horrible...
AST2-4db4ic,Great cast! Looking forward to this.
AST2-4db4ic,Oh por Dioooooooos!!! 🤩
AST2-4db4ic,"""So sick of"" smacks of the current age to me. Spoiled the whole trailer for me. Still looks entertaining though."
AST2-4db4ic,This cast is greater than ever. Can't wait to see this adaptation.
AST2-4db4ic,"Pathetic. Save yourself the pain and money and watch the one and only worth your time.
1949 version, real drama and acting."
AST2-4db4ic,I might be a bit attached to the pbs adaptation but I’m excited for this one too.
AST2-4db4ic,BEST. XMAS. GIFT. EVER. !!!!!!!!
AST2-4db4ic,Joey Tribbiani needs to watch this so he finally understands it.
AST2-4db4ic,Great ANOTHER remake. As all creative is gone.
AST2-4db4ic,Omg a cast full of amazing peopleAHHH I LEGIT TEARED UP
AST2-4db4ic,"I like Timothée but I’m a little bored of seeing the exact same kind of acting from him. Take whatever movie he’s in, he has the same expressions. 😬😐"
AST2-4db4ic,I’m so excited to see this version. The 1995 version is my favorite cause it has Wynona Rider and Kristen Dunst In it.
AST2-4db4ic,And the Oscar Best Hair goes to Timothée Chalamet!
AST2-4db4ic,Ohhh my!!!! FINALLY!!!! And what a brilliant trailer with that brilliants score!!!!
AST2-4db4ic,*mAkE iT sHorT AnD sPiCy*
AST2-4db4ic,"Feels too contemporary, somehow. The sensibility, some of the dialogue, the trailer’s rhythms and fonts — a film can remain true to a period without feeling stodgy. Gerwig would do well to learn that lesson. She may have gone too far in trying to give us a Little Women for Millennial audiences. 😕 I’ll still see it, but the trailer has left me unimpressed. And I’ve been so excited for this one."
AST2-4db4ic,Please dubbed this movie in hindi......
AST2-4db4ic,Smells like Oscars...
AST2-4db4ic,"Joey: ""These Little Women. ...Wow!"""
AST2-4db4ic,I hope Emma and her wooden acting don’t ruin either Meg or the movie : /
AST2-4db4ic,Ok. But why? This didn't need to be rebooted or re adapted tbh
AST2-4db4ic,"YOU'RE NOT CRYING, I'M CRYING!"
AST2-4db4ic,I don’t see how the ‘94 version can be topped. Or should be for that matter. Especially Thomas Newman’s brilliant score.
AST2-4db4ic,oh wow renata and mary louise what happened
AST2-4db4ic,I forgot this is another generation so of course they're going to remake it again for the next era my personal favorite when I was a child is the one that starred with Kirsten Dunst Winona Ryder Claire Danes Samantha Mathis Christian Bale and Susan Sarandon now that was a star cast but we're talking about almost 30 years ago
AST2-4db4ic,The hype is real! Cant Wait.
AST2-4db4ic,"This movie looks amazing!!! And it has Emma Watson, Timothèe Chalamet, and Saoirse Ronan, so it HAS to be amazing!!!! (And it also has Meryl Streep and Laura Dern which is further proof that there is NO WAY that it’s not going to be great)."
AST2-4db4ic,No thank you
AST2-4db4ic,I always wanted  jo/laurie together 😭😭😭😭😭😭
AST2-4db4ic,"I NEED to see Emma Watson, Saoirse Ronan, and Timothee Chalamet promoting this movie on The Graham Norton Show. I'm 100% into this movie for those three actors in particular."
AST2-4db4ic,"Seems like they're more so bent on the sexist aspect of the story rather than the whole plot. The book isn't just about the people who told Jo she couldn't write, its about all the sisters choosing the lives that they wanted. Its about the way they all grow as people. Hopefully this version captures that."
AST2-4db4ic,"“Women, they have minds, and they have souls, as well as just hearts. And they’ve got ambition, and they’ve got talent, as well as beauty, and I’m so sick of people saying that love is just all a woman is fit for. I’m so sick of it!”

I felt that."
AST2-4db4ic,OMG ISBEHJEHDIEIWHDIEISHHWJDBANAHSUDSJSIWJHSUEKWVHW HELL YEAH
AST2-4db4ic,YAAAASSS TIMMYYYYYY
AST2-4db4ic,Thanks Sony p.
AST2-4db4ic,"Can't replace Christian Bale and Winona Ryder, ya just can't. I'll keep an open mind, but the previous version will always be better. 🤷🙌"
AST2-4db4ic,"Surprised they didn't make this a gender swapped remake. Hollywood sure likes to ""represent"""
AST2-4db4ic,Saoirthée Nation Rise!!!!
AST2-4db4ic,YESSS MY BABY TIMOTHEEEEE !!!!!!!!!
AST2-4db4ic,please CAPTION - how can i see if i think you are envisioning one of my favorite books if I cannot understand the words the characters are saying... please CAPTION so those of us who cannot hear speech can enjoy your work
AST2-4db4ic,The pop music kind of ruins it.
AST2-4db4ic,This story must hold the record for the most film adaptations. I've lost count.
AST2-4db4ic,I grew up watching the Winona Ryder version and love it so much. Im intrigued to watch this one
AST2-4db4ic,Saoirse said PERIOD 🔴 pieces ONLY
AST2-4db4ic,Winona Ryder like: is ma version a JOKE to you!!!
AST2-4db4ic,Nahhhh
AST2-4db4ic,"...no one else can be Jo. No one. Don’t you dare say my Keira Knightley ain’t appearing in this here film, or Imma have to go all Miss March on your asses"
AST2-4db4ic,"@1:34 I almost expect Jo to break into a song ""Astonishing"" 😭😭😭😭😭"
AST2-4db4ic,Out of all the classic literature you could have adapted at least it's not the old man in the sea
AST2-4db4ic,Little Hoes
AST2-4db4ic,what is this song
AST2-4db4ic,one of my favorite books so glad this is an adaptation i can watch!
AST2-4db4ic,"Don’t be fooled, trust me when i say that all of them teens (of all shapes and colors) will watch this and eat it up like crazy."
AST2-4db4ic,Timothee without Armie is gonna have to take awhile for me. Although I loved Christian Bale. But classics are always done over again and again and again.
AST2-4db4ic,This looks like a beautiful film. Can’t wait to see it!!! December is too far away!
AST2-4db4ic,these women are of average size
AST2-4db4ic,OH FUCKING HELL I MUST SEE THIS!!
AST2-4db4ic,Aahh I'm freaking out!! I've been waiting for this for months! 🤩🎉
AST2-4db4ic,Surprised they didn’t make one of them black
AST2-4db4ic,Awesome
AST2-4db4ic,"Laurie: Jo, we can be together.
Jo: But what about Oliver?"
AST2-4db4ic,"this looks great, I wish it was based off of the musical tho. Still looks amazing"
AST2-4db4ic,"Oprah says: You get an Oscar, you get an Oscar, you also get an Oscar!"
AST2-4db4ic,I wanna hate this so badly. There have been sooooo many remakes.  But the cast. I have to see it now
AST2-4db4ic,Hopefully they don't cut out that super hot bikini scene in this adaptation.
AST2-4db4ic,Timothee Chalamet and Emma Watson in the same movie. sign me up nOW
AST2-4db4ic,So fucking excited!!!!! ❤️❤️❤️❤️🤪🤪🤪🤪😫😫😫😫🤯🤯🤯🤯
AST2-4db4ic,I’m working on a novel
AST2-4db4ic,#34 on trending
AST2-4db4ic,Someone os getting an Oscar nomination.
AST2-4db4ic,Timotheeeeee
AST2-4db4ic,"Watch it now, I think you mean non binary gender neutral A identifiable  possible trans but not necessarily of the LGBQ perspective or 2++ disadvantage in height. Trailer"
AST2-4db4ic,I want saoirse win the oscars next year.
AST2-4db4ic,CANT WAIT FOR IT!!! congrats miss Greta Gerwig and to the whole amazing cast of this movie! 💜💜💜
AST2-4db4ic,YALL DID IT AGAIN
AST2-4db4ic,1:09 Reminds me of dancing Elio 😁
AST2-4db4ic,Little women by DJ Khalid
AST2-4db4ic,Timothee Chalamet's smokin' hot hot hot 🔥
AST2-4db4ic,"Ugh, Timothee, why do you have to be so goddamn adorable"
AST2-4db4ic,Meryl streepppppp yeasss
AST2-4db4ic,omg timothee looks so yum🤤
AST2-4db4ic,So a sjw version of manshaming movie.
AST2-4db4ic,Maybe jo will end up with laurie this time
AST2-4db4ic,This trailer makes me so excited! Just look at that cast! And I'm not trying to compare or anything but I think Saoirse channels that perfect Winona Ryder passion and angst for the role haha.
AST2-4db4ic,My favorite boring book.
AST2-4db4ic,OOOOOOSCAR BAAAAAAAIT!!!
AST2-4db4ic,Thank you!
AST2-4db4ic,Im actually read the book right now lmao. What a coincidence !!!
AST2-4db4ic,This is the best protray of these character
AST2-4db4ic,I have literal tears in my eyes. What an absolutely beautiful trailer. Can't wait to watch the film :)
AST2-4db4ic,Why is Timothée Chalamet so charming in this movie?
AST2-4db4ic,can Jo & Laurie end up together in this adaptation please? just once? PLEASE?
AST2-4db4ic,Oscar Bait
AST2-4db4ic,The only book that Joey loved that isn't starred by Jack Nicholson is now a movie
AST2-4db4ic,1:40 OK WE NEED THE SOUNDTRACK ALBUM NOW MY SPINE IS FEELING THE CHILLS
AST2-4db4ic,"Emma Stone was originally cast in this movie, but her schedule didn't allow her as she had to attend the promotion tour of The Favourite. Emma Watson was chosen instead."
AST2-4db4ic,"1994: Haven’t been born yet.
2019: *TAKE ME TO SEE IT THIS WILL BE THE FINAL FILM OF THE 2010s DECADE*"
AST2-4db4ic,"I love the fact that people don't just remeber friends, a show that ended 15 years ago, but you can actually  find references to it in the trailer of a book that a character once read in one episode"
AST2-4db4ic,"I'm a big fan of most of the adaptations of this story and with the team involved in this one, it looks like I'll have another to love. :D"
AST2-4db4ic,Eliza Scanlen should've been Amy...she's the baby
AST2-4db4ic,I’ll wait till they remake this movie again and it’s about adrienne bailon naturi naughton and kiely williams or it’s about women with dwarfism who live in LA New York Atlanta and Dallas.
AST2-4db4ic,I think if Emma was joy it's better than mage
AST2-4db4ic,"Mamma Mia, Beauty and Beast, Lady Bird, Call Me By Your Name
one's view of the world mix.
etc. japanese title ""WAKAKUSA MONOGATARI"""
AST2-4db4ic,Saoirse !
AST2-4db4ic,I watched the Japanese animation of Little Women as a kid. Looking forward to seeing this.
AST2-4db4ic,"YESSSSS FLORENCE, OUR MAY QUEEN!!"
AST2-4db4ic,Hopefully they stay true to the ending of the book but this trailer doesn't give me hope for that... still looks amazing though!!!
AST2-4db4ic,A film within a film?
AST2-4db4ic,I'll be the only dude in the theater but sign me up!
AST2-4db4ic,WHY DOES THIS FEEL LIKE A CONTEMPORARY YA NOVEL ADAPTATION WHY DO I LOVE IT
AST2-4db4ic,Timothée kill me already i just love him so much EYE-
AST2-4db4ic,Little Women is one of my favorite books. This trailer looks like the did it right.
AST2-4db4ic,"timothee and emma in the same movie? my 2 favs, I'm dying 😭😭😭"
AST2-4db4ic,She married Professor Bhaer. Lol.
AST2-4db4ic,Classic.
AST2-4db4ic,What a lovely lineup.
AST2-4db4ic,I have never fallen asleep during a trailer before
AST2-4db4ic,It’s too much. TOO MUCH FOR MY POOR HEART THIS BOOK WAS MY LIFE. AND NOW MY MOST LOVABLE ARTISTS IN WHOLE UNIVERSE BRING IT BACK TO LIFE. THANK YOU THANK YOU THANK YOU THIS IS MORE THAN I EVER IMAGINED♥️♥️♥️♥️♥️♥️♥️♥️♥️ I LITERALLY CRIED!!!!!!!!!!
AST2-4db4ic,"Aaaaaaaaaaaaaahhhhhhhhhh!!!!!!!
Already crying."
AST2-4db4ic,Wtf is this feminist cringe
AST2-4db4ic,pass  ewwww emma watson.that stupid feminist
AST2-4db4ic,I'm a big man who loves Little Women.
AST2-4db4ic,Fact: I'm gonna cry the whole movie.
AST2-4db4ic,There's big women in this too right?
AST2-4db4ic,They look like big women to me.
AST2-4db4ic,Emma Watson I’m so happy
AST2-4db4ic,This looks horrendously boring.
AST2-4db4ic,"this is my favorite book and Greta is one of my favorite writer/director and these are my favorite actor and I'm going to enjoy every minute of it!!! and also cry, I just did it and it's only the trailer"
AST2-4db4ic,I got a bad feeling about this year's oscars
AST2-4db4ic,"I read little women in highschool of 2011, I found the whole 1970 miniseries version o youtube, and really liked it. I was exctatic to watch the 1994 film and I loved Winona, and it was fascinating how starkly different it was from the more bright colorful miniseries. Its funny how its so obvious what era a period drama was released, with the exception of a few."
AST2-4db4ic,emma watson looks more like belle here than in the movie she literally supposedly portrays belle
AST2-4db4ic,I’m so excited! can’t wait for this😿
AST2-4db4ic,"chills, luv"
AST2-4db4ic,jo rejecting laurie gets a million times heartbreaking like girl thATS TIMOTHEE CHALAMET WHAT IS U DOIN
AST2-4db4ic,Can't wait to see it!!!
AST2-4db4ic,I just saw the episode of Friends in which Joey reads Little Women and Rachel ruins the plot for him. I hope Beth is well at the end :/
AST2-4db4ic,"I'm really not going to be able to handle another adaptation of this where Jo and Laurie don't end up together, especially since it's Saoirse and Timothee IM GOING TO BE EMOTIONALLY WRECKED"
