Video ID,Comment
AST2-4db4ic,"Trailer shows how inspiring Jo as  independent woman etc etc etc

My reason to watch this movie: just witty liner  ""well ,that's because I'm rich"""
AST2-4db4ic,"Saorise ronan,emma watson,and timothee chalamet are the best...and it will be worth it i wanna watch it so badd😔❤"
AST2-4db4ic,I clicked because of emma watsons
AST2-4db4ic,"Still heartbroken they replaced Emma Stone with Emma Watson. I know it was a schedule thing, but I would have loved to see Saoirse and Emma share the screen."
AST2-4db4ic,Be great or nothing. Well said
AST2-4db4ic,Saoirse Saoirse Saoirse anyone hearing huh I'm her hooting man she's my heart
AST2-4db4ic,I love little women I remember my mum reading it to me
AST2-4db4ic,I can’t even count the amount of times I’ve watched this
AST2-4db4ic,What is the music playing during the scene where Jo is dancing?
AST2-4db4ic,"I love the Little Women movie from 1949. That's the best one yet with June Allyson who played Jo the somewhat tomboyish and boisterous sister, Elizabeth Taylor who played Amy the selfish pretty one who was interested in mostly herself but grew up to be a thoughtful and loving woman,  Beth the tenderhearted, sweet, selfless girl who dies much too young, and Janet Leigh who played the older very stable and sensible sister Meg. I never tire of watching it. It takes me back to a simpler time when family and friends were truly there for each other."
AST2-4db4ic,🤡
AST2-4db4ic,"When I was 10 years old I read this book and I absolutely love it, now I’m almost 19 and I can’t wait to watch the movie  🥺"
AST2-4db4ic,"I'm triggered that they have American accents, sorry"
AST2-4db4ic,"I’m honestly so excited, this trailer looks very promising."
AST2-4db4ic,小妇人
AST2-4db4ic,I feel like they purposely put every hair color blonde redhead brunette and black. Lol but for what reason? Hmmmm.... Oh and the male love interest are jewish HAHAHA 😆
AST2-4db4ic,"*these little women!*
*Rachel: Yeah?*
*Joey: How little are they? I mean, are they, like, scary little?*


*Chandler: What do we do? What do we do?*
*Ross: I suppose we just try to not look directly at it.*
*Chandler: Like an eclipse!*


*Joey: Oh, yeah! Amy just burned Jo's manuscript. I don't see how he could ever forgive her.*
*Ross: Um, Jo's a girl, it's short for Josephine.*
*Joey: But Jo's got a crush on Laurie. Ohhh! You mean it's like a girl-girl thing? 'Cause that is the one thing missing from The Shining.*"
AST2-4db4ic,I can’t wait to see
AST2-4db4ic,"Sony and Warner going for quality films 👍
2019 is saved."
AST2-4db4ic,"This movie looks absolutely amazing! I love that it still has that classic feel while also seeming modern than previous adaptations. Also Saoirse, Timothee, Florence, Meryl and Eliza in a movie together? Please and thank you!"
AST2-4db4ic,She married to panda 🐼 from dude perfect
AST2-4db4ic,Julia Garner should really have been Amy.
AST2-4db4ic,What’s the song that starts at 1:35?
AST2-4db4ic,If anybody feels like seeing Maya Hawke from Stranger Things as Joe watch the PBS version while your waiting for this to come out.
AST2-4db4ic,This book made me fall in love with reading!
AST2-4db4ic,SONG AT 1:22???
AST2-4db4ic,“valetudinarian”
AST2-4db4ic,I keep watching this over and over ICANT WAIT
AST2-4db4ic,Oh I really do hope they changed the ending of little women I couldn’t bare going through ‘that’ again.
AST2-4db4ic,Hoping the new generation reads the book and also sees the 1994 film classic
AST2-4db4ic,Littul waemen?
AST2-4db4ic,"Ronan, Pugh, and Watson.  Yes, they are talented but also all knockouts in their own ways"
AST2-4db4ic,We just want mcu Spider-Man.
AST2-4db4ic,Hermione what are you doing there-
AST2-4db4ic,I already love the original I know i will love this.
AST2-4db4ic,"These accents are all terrible, especially Emma’s"
AST2-4db4ic,I feel like I just watched the whole movie.. not much of a reason to go see it now.
AST2-4db4ic,Emma Watson 😍
AST2-4db4ic,"Just watched the 1995 version today for the first time. I was blown away by Winona Ryder's performance of Jo (she was nominated for an Oscar but lost to Jessica Lange for Blue Sky) She was so expressive even with no dialogue, and really embodied the character's passion, stubbornness, independence, and heartache. One of best female performances I've seen. Looking forward to Saoirse's portrayal."
AST2-4db4ic,"When everyone says ""im here because of emma.... etc"" and i was like *SIS IM HERE FOR MERYL*"
AST2-4db4ic,"Omg Louis Garrel is gonna be the Professor??! Well, yeah go get it Jo March!"
AST2-4db4ic,Amy is miscast. They should have hired a younger girl because that is one of the greatest things in Little Women. Laurie only saw Amy as a little sister until circumstances brought them together again. Like how Kirsten Dunst was cast then another actress was hired when she grew up.
AST2-4db4ic,"Честно говоря не я их себе представляла ,они же большие ,а в книге они подростки"
AST2-4db4ic,Ema Watson fan 😍😍😍😍
AST2-4db4ic,Emma Watson is perfection ❤️❤️
AST2-4db4ic,Sony is a money eating company
AST2-4db4ic,Dont take spider pleeazeeeeee eeeeeeeeee
AST2-4db4ic,Any other people out there that are 20 year old or older that are Emma Watson fans ?
AST2-4db4ic,The prequel to Lady Bird. Just kidd'n lol. ☕
AST2-4db4ic,Love this type of movies 🙂👍
AST2-4db4ic,My favorite book turned into a movie with my favorite actor and actress playing my favorite characters?? IM NOT READY
AST2-4db4ic,"If people ask about my favorite film, ""well just seen the trailer but little women, no doubt"""
AST2-4db4ic,I love the original and to be honest I can not wait for this one.
AST2-4db4ic,30.8.19
AST2-4db4ic,Any who blames Sony for Spider-Man should also blame Disney
AST2-4db4ic,Is nice and beautiful saoise with emma one movie.
AST2-4db4ic,I'm still seeing this movie. Anyone else with me?
AST2-4db4ic,"I was going to say ""too soon"" for a remake... then I realized the Winona Ryder version came out TWENTY-FIVE YEARS AGO~~!!! 😱😱😱"
AST2-4db4ic,Follow me la Chaîne ❤❤
AST2-4db4ic,Im auditioning for the musical of this at my school!!! Very excited since this is little woman is my favorite book and movie
AST2-4db4ic,I want spiderman back in the mcu!!!
AST2-4db4ic,I hope that they'll make Jo and Laurie end up together in this movie 😭
AST2-4db4ic,Give marvel spiderman back >:v
AST2-4db4ic,Return Spiderman...
AST2-4db4ic,I would've like for Amy March to be little like I'm the original
AST2-4db4ic,Excited for this ☺
AST2-4db4ic,Sony pleess do kontcrk agn wiht mcu pleeesss wi love spiderman in mcu pleess we need spiderman in mcu sony
AST2-4db4ic,Plees give back spiderman tu mcu i love spiderman and tom
AST2-4db4ic,definitely going to watch this after i read the book 😍
AST2-4db4ic,"Disney: sooo, can we have 50% of the movie"
AST2-4db4ic,Looks all right. Except for the accent. English Meg and Irish Jo indeed. Can’t they use Americans to play Americans? (And I’m not even American).
AST2-4db4ic,Am I the only who doesn't know any of these actors/actresses that u guys mentioned?
AST2-4db4ic,"Reminder that the OST of the 1930's version is what spawned the now Infamous ""Hotel Mario"" theme.


Don't believe me? Look it up!"
AST2-4db4ic,The quality of the trailer seems to be early 2000s vibe.... I love it
AST2-4db4ic,Nice  😂
AST2-4db4ic,Why do they have to ruin things?
AST2-4db4ic,I expected them to be much shorter.
AST2-4db4ic,"Rachel: Beth dies
Joey: 😨🥺☹️"
AST2-4db4ic,sweet tea
AST2-4db4ic,Sony stop making shitty movies
AST2-4db4ic,SONY YOUR GAY SPIDER-MAN IS AWSOME LONG LIVE THE KING SONY MICROSOFT BEST NOW
AST2-4db4ic,I never watched a movie trailer as many times as I hv watched this. ❤❤❤
AST2-4db4ic,Lady Bird Part Two.
AST2-4db4ic,i can‘t wait to see the movie！love the cast soooo much！！！
AST2-4db4ic,"""Women have brains ... bla bla bla"" LOL"
AST2-4db4ic,I hope the movie is better than the book
AST2-4db4ic,just another feminist movie... ugh
AST2-4db4ic,"Loved the trailer and of course, the book. But I have an observation. I noticed at the end of the official trailer, they list Timothee Chalamet and Chris Cooper ahead of Laura Dern and it's called Little WOMEN. Just saying."
AST2-4db4ic,"We don´t need this. 
we have Winona´s version. 
The true Jo March Forever & Susan Sarandon Marnie´s. ♥♥"
AST2-4db4ic,"Chalamet is so cringe to look at, why is he even an actor, is being a jew automatically means you should be an actor?"
AST2-4db4ic,lol bunch of cucks are going to love being subverted by this movie.
AST2-4db4ic,WTF
AST2-4db4ic,It's interesting hearing Emma Watson with an American accent
AST2-4db4ic,this movie is gonna BOP
AST2-4db4ic,i wanted to see this movie in theaters but now i can't cause it's a sony film :)
AST2-4db4ic,I've never related to someone's words before Jo.
AST2-4db4ic,"This movie will never be so perfect like the movie with Winona Ryder as Jo March. She was and still is the perfect actress for Jo. And it´s the same with Trini Alvarado as Meg March, Claire Danes as Beth March, and Kirsten Dunst (later Samantha Mathis) as Amy March. There are so many movies about the March-family, from 1917 to 1994, and the movie from 1994 is the best (nominated for three Acadamy Awards). I like Emma Watson and Saoirse Ronan, but they can never be so perfect like the actresses from the adaption from 1994."
AST2-4db4ic,Florence Pugh is everywhere. What a year for her.
AST2-4db4ic,TIMMY TIM
AST2-4db4ic,Oh😍😍😍 Can't wait.
AST2-4db4ic,Emma should have been Jo.
AST2-4db4ic,ı love hermione
AST2-4db4ic,I hope this is spectacular!
AST2-4db4ic,甜茶😘
AST2-4db4ic,"""So who does she marry?"" 😑




Me: Sir, you need to watch your own movie. 😅"
AST2-4db4ic,"This seems like a really unnecessary adaptation to me and I doubt it'll be better than the 1994 version. 


The casting is questionable. The actors are all great in their own right but some of them don't make sense as these characters. It looks like they're going to have Florence Pugh play Amy throughout the entire film but that doesn't really work for the character. She's the youngest at 12 when first introduced. Her relationship with Laurie is supposed to begin as a one sided crush on her part, with him not really noticing her at all until they run into each other in Europe and she's a grown woman. Timothée Chalamet as Laurie doesn't really work either, at least not post time skip. He has a baby face, looks like he's 16 (which will work great for his role as the 15 year old Paul Atreides in Dune!). I also don't think Louis Garrel is old enough, or looks old enough, to play Friedrich Bhaer. He's supposed to be significantly older than Jo."
AST2-4db4ic,Big women or gtfo
AST2-4db4ic,screw sony
AST2-4db4ic,"Well, I'll give it a look see. I'm still a fan of the June Allison version and I know Ill get beaten down for this comment but really Meryl Streep AGAIN? Gosh, can't she stay home? She had to turn up in Mary Poppins'for some unknown reason but really is every remake gonna have  spot for her until she retires?"
AST2-4db4ic,Puke. The very American novel turned into a movie with four foreign actresses. Cast American!
AST2-4db4ic,I’m sooo excited
AST2-4db4ic,Can't wait to see it. Loved Elizabeth Taylor and Wonona Ryder in previous versions.
AST2-4db4ic,"I saw the thumbnail and I saw the title and this montage and, sadly, this is exactly what I expected it would be."
AST2-4db4ic,Where is Bhaer?
AST2-4db4ic,"2019 advice to the bachelors: Pre-nup, because >50% divorce rate and those are some man-hating bitches you’re looking at."
AST2-4db4ic,They are like 30. Not little women at all
AST2-4db4ic,"My sister did a play on this, she was Beth, she died



NOT MY SISTER BETH, HER CHARACTER, oh my GOSH I just realized how that sounded. She happy n healthy, She played as Beth and BETH died not my sis.🤣"
AST2-4db4ic,Sony devolve o homem aranha porraaaa
AST2-4db4ic,BRING BACK SPIDER-MAN
AST2-4db4ic,Im begging you please give back spider-man to the mcu
AST2-4db4ic,Una miarda como siempre pedazo de miards
AST2-4db4ic,"Can someone explain what it means when Marmee says, 'there are some natures too lofty to bend'?
Thanks!"
AST2-4db4ic,"Dislike, bring back Spiderman dumbasses"
AST2-4db4ic,Sony has ruined Spider-Man
AST2-4db4ic,Saoirse Ronan is underrated. How does an actor make you feel that much in 10-15 second clips??
AST2-4db4ic,😍
AST2-4db4ic,"I hate you Sony I hate you Sony I hate you Sony I hate you Sony I hate you Sony I hate you Sony I hate you Sony 
You are stupid no one will watch your version spider man tell that fat producer to give spider man back to Disney"
AST2-4db4ic,"I really hope the directors would change the ending from the book's, Saoirse and Timothee have such an amazing chemistry! Hope Jo and Laurie would end up together... I mean, how can you not ship it, especially at 1:35?"
AST2-4db4ic,Ough salamun
AST2-4db4ic,"Why cant you leave the love of books alone 
Stop making books to movies"
AST2-4db4ic,NO ONE CARES ABOUT THIS. WE WANT SPIDEY BACK ASSHOLES!!!!
AST2-4db4ic,Subscribe to Leslie bass for all your little women la gossip
AST2-4db4ic,These live-action remakes needa stop......
AST2-4db4ic,To bad that NAZI MUSLIM DEMONRATS AND THIER SUPPORTERS HAVE MO TALENT OR CREATIVITY OR IMAGINATION THEY HAVE TO REDO OTHER PEOPLE'S WORKS.
AST2-4db4ic,"so, a remake - of a remake - of a remake - of a remake of a book. that’s a new one 🤷‍♀️"
AST2-4db4ic,"I was reading a children's book today and then I got this nostalgic memory of a name Jo, which I remember reading from a book when I was young. I can barely remember the story's name. All I remembered was there are four sisters and some tragic deaths. so I looked it up on the internet, then I found Little Women. This is the first time I remembered that book from a long time ago, and It's a beautiful coincidence that it's now having a movie. Wow."
AST2-4db4ic,bring spidey back
AST2-4db4ic,Xxx indo com
AST2-4db4ic,Hearing Emma Watson with an American accent is SO weird...
AST2-4db4ic,"99% of the comments quoting  
WeLl tHaTs bEcaUse iM RiCh"
AST2-4db4ic,Why you kill spidey
AST2-4db4ic,"Well they could've added this -
Academy Award winner -
Meryl Streep
Academy Award nominee-
Saoirse Ronan
Academy Award nominee-
Laura Dern
Academy Award nominee-
Timothee Chalamet"
AST2-4db4ic,I would like Saoirse and Timothee to just get together already.
AST2-4db4ic,Mi spidey
AST2-4db4ic,Everybody who likes this comment stoped playing PlayStation because of Sony taking spider man out
AST2-4db4ic,*Bring Back Spider-Man To The MCU!!!*
AST2-4db4ic,I love it already
AST2-4db4ic,Bring back Spidey to mcu
AST2-4db4ic,Also. Meryl Streep will never surpass Angela Lamsbury in this role...
AST2-4db4ic,Strange that two adaptations of Little Women have been made so close together. Not complaining as I loved and re-read these books throughout my childhood.
AST2-4db4ic,"Get lost Sony you waste of space, hope you all lose your jobs"
AST2-4db4ic,Keep Spider Man in MCU
AST2-4db4ic,GIVE SPIDER-MAN BACK
AST2-4db4ic,Bring spider man back into the MCU
AST2-4db4ic,"""well that's because I'm rich""
😆😆😆"
AST2-4db4ic,I wish they would stop remaking movies 😭
AST2-4db4ic,😢😢😢😢😢
AST2-4db4ic,Sony you suck you stole spider man
AST2-4db4ic,Excited to see this with all the great talented people who are in it.  But the main reason I'll watch it is for Timothee Chalamet (and Timothee Chalamet's HAIR)!!
AST2-4db4ic,I want to be great or nothing 👍
AST2-4db4ic,Thank you for the magic- I hope the spirit of the original shines through- as perfectly ordinary AND extraordinary as the lives of these girls in those interesting times. May you be scintillating as a truly original work of art!
AST2-4db4ic,I don't care! I'm done with Sony's films! I unsubscribed and will no longer support Sony for taking away Spider Man from the MCU 😭😭😭
AST2-4db4ic,"Suppose you visited an Asian country and learned that the government was busy importing millions upon millions of non-Asians into the country.
Supposed you were told that non-Asians were projected to be a majority in the country within a few decades.
Suppose you found that Asians were called ""racists"" if they objected to this.
Wouldn't you say to yourself, ""What's going on here?""?
Now change ""Asian"" to ""White"" and that's exactly what's happening in ALL White countries and ONLY in White countries. It's White genocide.
Anti-racist is a codeword for anti-White."
AST2-4db4ic,done you Release in hindi
AST2-4db4ic,AHHH EMMA WASTON (FAN no I'm not fan girling eh
AST2-4db4ic,Winona has spoiled me. I can't accept a new Jo.
AST2-4db4ic,HEYU FIRE sIDER MAN
AST2-4db4ic,One like to bring spidey back
AST2-4db4ic,*saves*
AST2-4db4ic,*shares on story*
AST2-4db4ic,ty for the dt💖💖
AST2-4db4ic,Was interested until I saw the evil witch streep
AST2-4db4ic,you snapped!
AST2-4db4ic,a serve
AST2-4db4ic,The female victim complex is so strong.
AST2-4db4ic,"Do women never get tired of the pandering?


I guess not."
AST2-4db4ic,"Let me guess... it's feminist ""badass"" girl power propaganda?


EDIT
yup"
AST2-4db4ic,Dislikebpor spidey
AST2-4db4ic,I'm actually reeaally excited to see this! I'm currently reading the book I'm so excited!!
AST2-4db4ic,I have watched this a hundred times for the monologue montage alone. I can't wait to watch the whole thing!
AST2-4db4ic,I hope I can c it in China
AST2-4db4ic,I loved this book when I was young and now I see it come to life with a modern and very talented cast. I'm so excited!
AST2-4db4ic,I WANT PHOTOS! PHOTOS OF SPIDER MAN ! IN THE MCU
AST2-4db4ic,BRING SPIDERMAN BACK
AST2-4db4ic,Give Spider-Man back
AST2-4db4ic,So the favorite book of Rachel from Friends is going to be a film! So excited!
AST2-4db4ic,The book was so beautiful!
AST2-4db4ic,"I can't wait. Such great cast... Timothee and Saoirsa!!! Okay, I misspelled both names, right?"
AST2-4db4ic,As always Saoirse doing her best performance
AST2-4db4ic,"Another woman empowerment, as long this avoid woman appear on regetoon videos I´m in!"
AST2-4db4ic,"Timothee Chalamet, Emma Watson and Saoirse Ronan in the same film. Can the world be more kind?!"
AST2-4db4ic,Meg sort of looks like Cristine from 'Simply Nailogical'.
AST2-4db4ic,"Already reading the hardcore book lovers comments and the younger, at least at heart, ones admiring Glenn Close's sass.🤣"
AST2-4db4ic,"Well im a big fan of Emma Watson but im here to see Meryl Streep and Saoirse Ronan!! 😍😍😍
3 of my Fave actresses in one movie"
AST2-4db4ic,"yay,  an actual historically accurate movie where whites dont have to be guilt tripped about Africans ."
AST2-4db4ic,You monsters took spiderman
AST2-4db4ic,Check Out My Movie Trailer 🎥⤴️
AST2-4db4ic,Как называется пестня которая играет в трейлере????????
AST2-4db4ic,anyone know who’s going to play Fredrick?
AST2-4db4ic,"Ahhh I love Jo, well I love the anime styled little women.. I forgot was it 80’s or 70’s..

Wait Won’t beth die in the movie?"
AST2-4db4ic,My favorite novel is getting a movie I'm ever so happy 😭💖
AST2-4db4ic,WWHHAATT!!!!   I Actually love this!!!
AST2-4db4ic,"I don't get it, they look normal sized to me?!?"
AST2-4db4ic,que tristeza los ejecutivos de Sony entertainment .......... no volvere a tener nada  con ustedes.... porque sacan del mundo Marvel a SPIDERMAN????
AST2-4db4ic,definitely will be a *PORN* version to this one within 5 months
AST2-4db4ic,Spoiler: Beth dies near the end.
AST2-4db4ic,Bring us spiderman back!!!!!
AST2-4db4ic,Song?
AST2-4db4ic,Your not goner make a better spiderman with out marvel stop hateing your going to rape sexually abuse spiderman for a little bit of money then sale him anyway like a hore
AST2-4db4ic,"Hey SONY... Muerete, nos quitaste a spiderman.... Traelo de vuelta..."
AST2-4db4ic,EMMA WATSON IS EVERYTHING
AST2-4db4ic,"Sounds like ""what if superman were evil"""
AST2-4db4ic,Give spider Man back to the mcu assholes
AST2-4db4ic,"'And they realised there were no longer little girls, they were little women'"
AST2-4db4ic,Idiotas van a arrunar a Spider man d nuevo si c lo llevan d MARVEL 😤😬
AST2-4db4ic,Why do you do this Spider-Man is the best in marvel and you take him and put in another universe plz put it back
AST2-4db4ic,Los odio
AST2-4db4ic,Yeah i'm not married because i'm 20 years old😊
AST2-4db4ic,"*Bye SPIDERMAN.*

*1 like = 1 prayer*"
AST2-4db4ic,Thanks..... For Killing our friendly neighbourhood spiderman.... Spiderman without MCU is nothing... If you need those  1 bn so badly then make a money collection sort of thing where every one donates  a dollar or more ...... U will easy collect more than 2 and then please send him back where he belongs .... Anyone who agrees hit a like
AST2-4db4ic,beth dies
AST2-4db4ic,Stop! This Sony stop ruining spider Man !!!!!!!! Idiots !!! Stupid
AST2-4db4ic,Beth dies.....? 😢
AST2-4db4ic,Please do another movie Spiderman with marvel and Disney 😭We need him please
AST2-4db4ic,"The earth is in danger of ceasing its natural carbon recycling process thanks to just a handful of greedy humans. Are you enraged about this? Contact your local representatives and tell them to...

- Boycott food companies that accept and produce products from factory-style farms and agriculture (which is largely responsible for the clear cutting of the amazon forests and a huge percentage of greenhouse gas emissions.) 
- deny products into you community that employ slave labour, illegal logging, and environmental degradation of land and water to produce their products.
- Ban not only single use plastic bags. BAN single use plastic PACKAGING of products. Or tax them (the companies, not the people)
- stop accepting donations and lobbying for fossil fuel companies.  That's not democracy if you just keep ass kissing to billionaire company interests.
- subsidize local business and sustainable agriculture
- subsidize green energy production like Solar, wind and geothermal energy.
- promote healthier life styles. Ban car advertising in cities and promote public transit.
- put pressure on federal budgets to take away from military and nvest in green energy. (OR, if your country is too proud/dependent of its military, promote a reforestation/agriculture program within the military.)
- make investments into fossil fuel companies illegal and charge companies a fine for their continued ties with major oil and fossil fuel companies.
- promote reforestation programs.
- fine mines for every acre of forest and waterway they degrade through wreckless unsustainable strip-mining methods.
- fine fisheries that abandon their fishing nets in the ocean.

Join the movement, fight the symptom of climate pollution. 71% of the world's green house gas emissions comes from just 100 companies. We keep trying to reduce our carbon footprint individually, which is good and all, but the real problem comes from corporate interests. Remove that power from them, and real change will happen. Be part of the movement."
AST2-4db4ic,BRING BACK SPIDER MAN
AST2-4db4ic,Bring Spiderman back
AST2-4db4ic,IF YOU TAKE SPIDEY FROM MCU I'M NOT GONNA INVEST ANY MONEY IN SONY EVER
AST2-4db4ic,Biocote sony univees
AST2-4db4ic,For those who already know the story... I can’t wait to see what Greta decides to improve. I hope maybe a few things change. But keep the overall story. :)
AST2-4db4ic,Sony f you we want the McU have
AST2-4db4ic,IM NEVER WATCHING A SONY MOVIE AGAIN SPIDER-MAN IS MY HERO HE HAS HELPED ME THROUGH A LOT AND YOUR GOING TO TAKE THAT A WAY SCREW YOU AND IM TELLING ALL MY FRIENDS TO NEVER WATCH A SOMNY MOVIE AND UN FOLLOW THEM
AST2-4db4ic,"Who does Chalemet end up with? Yes I know there’s a novel, but I’m hoping they change the story somewhat. Won’t say more because that would be spoilers."
AST2-4db4ic,Is it just me or is Amy look to old. Is she not a little girl?
AST2-4db4ic,What in the hell are these accents? Is it Scottish? British? Southern? Got the whole world coming out. Ridiculous
AST2-4db4ic,SPIDER-MAN!!
AST2-4db4ic,Spider man?
AST2-4db4ic,"Emma is back all right ❤❤❤
She will rock it"
AST2-4db4ic,"Not sold on some of the obvious fake American accents, but I love the book and trust the director. I’m in"
AST2-4db4ic,"Love the book, best version ive seen is bbc miniseries."
AST2-4db4ic,Give Spider-Man back Sony your stupid if you don’t!!!!!
AST2-4db4ic,Bring back spiderman dheads
AST2-4db4ic,Lol
AST2-4db4ic,Lol
AST2-4db4ic,Sony sucks lol
AST2-4db4ic,Sony if you take away Spiderman from the MCU I will come to your basement that your hiding in rip of your arms and shove it up your butt
AST2-4db4ic,GIVE US SPIDER MAN BACK
AST2-4db4ic,"Maybe it's Greta Gerwig, or Saoirse Ronan, or Timothee Chalamet, or Meryl Streep, or Laura Dern, or Emma Watson, or the novel itself, or the promised the trailer has made, but I've already watched this clip for the 1000th time and I'm gonna keep coming back to it ❤❤"
AST2-4db4ic,"Sony no le quites spiderman a marvel solo vas a undir la franquicia como siempre además que hará spiderman sin marvel dime va a olvidar a iron man por casualidad no !!! 
Sabemos que solo te importa el dinerillo Sony basura :v"
AST2-4db4ic,We won’t watch a movie produced by SONY unless they put Spiderman right back where he belongs.
AST2-4db4ic,I am only like mcu spider man u need turn back of mcu family
AST2-4db4ic,This ain't Spiderman
AST2-4db4ic,sounds like a bangbros title
AST2-4db4ic,Put Spider-Man back in the MCU
AST2-4db4ic,#@please free spider man
