Video ID,Comment
AST2-4db4ic,I love eliza scalen to fucking death
AST2-4db4ic,AMMMAAAAA
AST2-4db4ic,Where can I watch it
AST2-4db4ic,whose watching this on Christmas!!!!???
AST2-4db4ic,And women think they have it tough these days
AST2-4db4ic,I can tell this is going to be one of my favourite films
AST2-4db4ic,"Oh GREAT !
1800's CAPTAIN MARVEL....
With LEFTIST  STREEP .....
I'll pass thank you very much."
AST2-4db4ic,"Next time Hollywood remakes the movie, they'll inject lesbians, a transgender, and add a black or yellow person in it as well. Why get creative, just take an oldie and change the character"
AST2-4db4ic,Will Jo and Laurie end up together in this version?
AST2-4db4ic,Sophia Lilith has the face for Jo and I think she’s the right age too
AST2-4db4ic,"I looooove this story, even though my favourite movie is the first one from 1949 (classic...) I always watch everyone is made, so I will watch this one too!! It really looks great!!"
AST2-4db4ic,"""I want to be great or nothing!! ""




Why do I hear these lines more clear than anything else!! 😬"
AST2-4db4ic,Looks Rubbish Winona Ryder best version
AST2-4db4ic,They should of got Moe Szylak to narrate
AST2-4db4ic,"The next Feminazi film. No, thanks."
AST2-4db4ic,This is what the Poe sisters were up to before Ganondorf took Hyrule.
AST2-4db4ic,I haven’t been this excited for a movie in a long time
AST2-4db4ic,Is this specifically based on the book or a remake of the 1994 movie?
AST2-4db4ic,"Holy cow, this is the girl from the lovely bones. I love that movie and I’m proud of her 👏oh shizzles it’s been a while 😂"
AST2-4db4ic,i love the fact that her last names march and march is women's history month
AST2-4db4ic,Meryl is perfect for the role of Aunt March.
AST2-4db4ic,"""I want to be great or nothing' 

Inspiring one❤️"
AST2-4db4ic,Hey you. Yea you scrolling thru the comments. What are you waiting for. Read the book its amazing
AST2-4db4ic,Oh I love Joe she is so sweet and in the book shes so nice
AST2-4db4ic,Yessssss. I read the 500 something page book a few years ago when I was 10
AST2-4db4ic,"Has anyone have an idea what is the song that goes from 1:03 to 1:20 ? 
I am dying to knooooow"
AST2-4db4ic,Okay can some one tell me who is this guy at 1:38 ?
AST2-4db4ic,"""You'll need to marry well!""
""But you're not married-""
""Well that's because I'm rich!""

Same energy as Cher's quote from an Interview:

""My mother always told me to marry a rich man and I said 'Mom, I am a rich man!'"""
AST2-4db4ic,poor emma watson shes done now!  hey lets KEEP REMAKING MOVIES! THATS AN ORIGINAL IDEA!!  looking forward to little women 2022
AST2-4db4ic,I wish Indonesia would be fast to put this movie on cinemas
AST2-4db4ic,:)
AST2-4db4ic,if jo and lawrence arnt gonna be together imma start a riot
AST2-4db4ic,Beth dies
AST2-4db4ic,"I went to a super conservative Christian school from elementary to my freshman year of HS. If I hadn't read Little Women or Anne of Green Gables, I feel like I would have a completely different view on  women and femininity and a whole lot of internalized misogyny."
AST2-4db4ic,Anyone know the song on the trailer?
AST2-4db4ic,This looks beautiful. And this is what a remake should be. A new adaptation and a retelling with a new feel and point of view on the novel.
AST2-4db4ic,"Little Women (1994) was done so, so well. If you have not seen it, please do so. I won't say anything negative against this remake, since I haven't seen it, and mainly because I know so many people put so much into it (cast and crew), yet, PLEASE do not undermine the greatness of the 90's adaptation. It is beyond worth seeing. It is the reason I value being an extra in Stranger Things (to say I worked on the same set as Winona Ryder, who touched my heart as Jo, when I was 5). I'm looking forward to the new adaptation, but PLEASE everyone watch the '94 Little Women...you won't regret it. It goes above and beyond expectations, relatabilty, and soulfulness. Claire Danes, Christian Bale, Susan Sarandon, Gabriel Byrne....."
AST2-4db4ic,"i will not be seeing this movie, not because there are women in it, but because there are men"
AST2-4db4ic,This story really didnt need to be remade with just a different set of white people
AST2-4db4ic,"of course the ""quirky"" ""independent"" ""free spiriteD"" girl gets the cute guy. its never any other way lmao"
AST2-4db4ic,"Last time I read Little Women was about 10 years ago, so now I'm rereading it to prepare for watching the movie. Im about a third of the way through the book, and it makes me very happy that I can already identify specific scenes I remembered reading. That is all :)"
AST2-4db4ic,"is 25 dec is the worldwide release or just in states? why there's not poster or anything like that yet on my country, i'm so affraid that they not gonna release it on my country"
AST2-4db4ic,I'm Still upset with Amy in 1994. How dare she burn Jo's book up! 😡
AST2-4db4ic,kok gua ga inget scene pas lagi nonton teater nya dh
AST2-4db4ic,Just for Emma 😍❤
AST2-4db4ic,Are timothée et saoirse's characters gonna be together in the movie???!
AST2-4db4ic,I am definitely looking forward to seeing this. Awesome casting. I hope the screenplay rises to the same level as the acting talent.
AST2-4db4ic,anyone know the song name at the end? Thanks !!
AST2-4db4ic,Emma Watson: queen of book adaptation movies😍
AST2-4db4ic,Literally timothée chalamet is so fricking hot and no one can tell be different
AST2-4db4ic,I like Meg and Jo! 😉
AST2-4db4ic,Of course they have to add modern feminist spins into it lol
AST2-4db4ic,"It's been DECADES since I read the book, but I don't remember Meg wanting to be an actress."
AST2-4db4ic,I want more of that 1:35 - 1:42
AST2-4db4ic,Nice try Meryl but Kathrine Hepburn was right about you. You're too fake to take part in a story like this.
AST2-4db4ic,"Question: is this movie only out on Christmas Day and then they’ll no longer play it again, or was I just imaging that? I would LOVE to go see it but if that’s the only day it’s out — I won’t be able."
AST2-4db4ic,Can you please tell me.... There are three little women movies. . Is this a continution Or something? Should I watch that to understand this..and where can i see this movie
AST2-4db4ic,"""I believe we have some say over who we love.""
""I think the poets would disagree.""
wow. please stop sleeping on this."
AST2-4db4ic,"2:14 melts me, every single time."
AST2-4db4ic,Statistics yo
AST2-4db4ic,1:38 is SO real i cant wait to watch this scene
AST2-4db4ic,does anyone else think that the actress for Amy is a little too mature to play the role for the youngest sister? I can see it as Amy is older but not as the little Amy.
AST2-4db4ic,Any feminists here?
AST2-4db4ic,I’m never going to be able to watch this without crying
AST2-4db4ic,The eye roll in the end by Jo Says it all...
AST2-4db4ic,I really like how the main logo of the film isn’t using a predictable cursive font. It feels modern
AST2-4db4ic,"I'm sure I'm going to love it because Little Women is one of my top 3 favorite books, I've read it dozens of times, but just from watching the trailer, I already see deviations from the book and that makes me unhappy hahaha. But I still have faith!"
AST2-4db4ic,Emma Watson still can’t act by the looks of it
AST2-4db4ic,This movie is SO amazing 😍
AST2-4db4ic,Aaaaaand dislike
AST2-4db4ic,Why do we need another one?
AST2-4db4ic,Tim others voice in the trailer is so calming 😂🤦‍♀️
AST2-4db4ic,Made me think of Joey and Rachel.
AST2-4db4ic,The Anime is much better ....
AST2-4db4ic,She sounds like the girl that is on tik tok😂 “guys like pterodactyls” 😂😂😭😭
AST2-4db4ic,"My heart while watching the trailer: *Saoirse Ronan* Yess
*Emma Watson* YESS
*Timothée Chalamet* YESSSS 😍"
AST2-4db4ic,What an All Star Cast they got here.
AST2-4db4ic,“I want to be great or nothing.”
AST2-4db4ic,How come they never talk about how racist a lot of white women were (and still are)? We need more films about that.
AST2-4db4ic,I just watched the 1994 one and I fell in love with it . And I already fell in love with this one just watching the trailer.
AST2-4db4ic,"""Little women? How little are they?"""
AST2-4db4ic,"I wonder if Jo will marry Mr. Baehr, like in the book, or if they'll write his kind and interesting character out for the sake of giving Jo a ""strong independent"" feminist life."
AST2-4db4ic,Can't wait to see it!!😀
AST2-4db4ic,Meryl Streep is completely in command of her performance as the mother of her ambitious and independent minded daughters
AST2-4db4ic,"I am so longing to watch this film! Saoirse, Emma, Florence, Meryl ... It can´t get any better!!!"
AST2-4db4ic,"Guys, these girls names are just like the Poe sisters names in Ocarina of Time video game.. Amy, Beth, Jo (elle), and Meg..!!!! Am I the only one who noticed?"
AST2-4db4ic,"From a four sister family, this story has always resonated with my family.❤️"
AST2-4db4ic,im a sap for this story so i think i will love it :)
AST2-4db4ic,Such a coincidence of how I am reading this book and it's in my recommendations 🤔
AST2-4db4ic,"""My name is Suzie Salmon, like the fish"""
AST2-4db4ic,"SPOILER FOR THOSE WHO HAVEN’T READ THE NOVEL

The line that Jo (Saoirse) says about how she’s “so sick of people saying that love is all a woman is fit for” and that whole monologue wasn’t in the novel. However, those were actually Louisa May Alcott’s words (the author of ‘Little Women’). She said it in response to her fans who kept asking why she finished the novel with Jo ending up with Friedrich instead of Teddy and how Jo choosing to keep her independence would still have been a better ending (I’ve seen this adaptation and it addresses and answers why Alcott had to end it that way.) Greta Gerwig chose to add it in the script as ‘Little Women’ is partly auto-biographical and based Jo off herself."
AST2-4db4ic,This movie gonna make me cry I can already tell.
AST2-4db4ic,"""Hated it"" you have to be an In living color fan to get it. Lol"
AST2-4db4ic,little woman 1994 is the best how ever this trailer seems to be adding things that weren't in the book not the beach scene but a few others also i don't much care for the new jo but maybe i will after i watch the movie
AST2-4db4ic,Is there anyone else who has seen the original anime?
AST2-4db4ic,Are they making Beth the youngest???? Amy is the youngest??? Also while I love how much respect Amy juice they drank where is the Beth rep?
AST2-4db4ic,They liberalised this movie. Loiusa May Alcott never wrote those lines. They turned it into typical feminazi garbage.
AST2-4db4ic,"Not sure about this version 🤔🤔🤔
Prefer the susan sarandon version"
AST2-4db4ic,"There is no fucking chemistry between Saorise and Timmy, they have more of a sibling energy between them! Can't anybody else see it?!"
AST2-4db4ic,Try 1994 version
AST2-4db4ic,does anybody know the name of soundtracks in this trailer?
AST2-4db4ic,"and this makes how many ""little women"" movies now???? man, come on..!! Can we get a movie that has not been done already several times. Does no writer have originality anymore!!"
AST2-4db4ic,Who else is furious and sad because the movie won't come out for another two months In their country
AST2-4db4ic,"I remembered reading the sequel of this novel. ""Little Men"" it was beautiful"
AST2-4db4ic,I can’t wait to watch the movie
AST2-4db4ic,It seems like a painted movie
AST2-4db4ic,what's the song that plays at 1:43 ?? i love it
AST2-4db4ic,I'm so excited for this movie!!!
AST2-4db4ic,I would prefer Judy dench or Maggie Smith
AST2-4db4ic,How many times are we gonna make this movie?
AST2-4db4ic,I'm here for Emma....bt i can see her hardly
AST2-4db4ic,best movie!!!!!!!!!!!!!!!!
AST2-4db4ic,emma watson timothy chamlet AND meryl streep in the same movie? my life’s complete.
AST2-4db4ic,It always reminds me of Racheal & Joey!
AST2-4db4ic,Will not watch because Meryl Streep; she hate our President Trump. Send Meryl Streep to a socialist country with all the other haters. Vote Dem Out....
AST2-4db4ic,"Who's the fan of ""Lady bird"" ?"
AST2-4db4ic,Can't wait!!!!
AST2-4db4ic,This will be a great movie to watch/
AST2-4db4ic,"Okay I love Emma Watson, and I’m going to see Little Women regardless, but omg her American accent is so bad. I’m hoping her accent isn’t as bad as the trailer shows it to be throughout the whole movie"
AST2-4db4ic,But Emma Watson was perfect for Jo
AST2-4db4ic,the background music is the best!
AST2-4db4ic,Anyone know the background song?
AST2-4db4ic,"This  trailer is impossibly basic, to be frank. This romanticization of aristocracy is bourgeoisie propaganda at its most crass.

Talk about another reason why funding & institutional support for cultural production desperately needs to be directed beyond this kind of political + class homogeneity. Who benefits from *more humanizing + centering of rich white settlers in this moment in history? Women or otherwise. Give thanks for our capacity for complex analysis. To not get fooled into calling something 'feminist' just b/c women or girls are involved when what's actually happening is the perpetuation of white supremacist, classist, colonial biases."
AST2-4db4ic,Why Emma didn't do press with the rest of the cast?
AST2-4db4ic,"Me watching a trailer: “Ugh that guy is so cute!” 
Me watching THIS trailer: “wow I’m such a LeSbIaN!!”"
AST2-4db4ic,What’s the song at 1:03 when jo and Laurie are dancing and towards the end?
AST2-4db4ic,1:35 I replayed this more times than I like to admit
AST2-4db4ic,0:48 this cracked me up 😂😂😂 definetly this would be my future.
AST2-4db4ic,"I have a feeling this will be another man hating movie lol another all female movie to cater to sjws...still mad trump won so hollywood is making more female and people of color movies now....i luved the 1994 version but ill skip this, and im a woman..."
AST2-4db4ic,It's sad I can't watch this film in my country :/
AST2-4db4ic,"*HEYYYYY THIS IS MY FAVORITE MOVIE LOL, especially the 1994 version one*"
AST2-4db4ic,The original is one of my favourites. I’m so excited for this one!
AST2-4db4ic,"laura dern, florence pugh, eliza scanlen, AND meryl streep? does that mean a man is about to be MURDERED?"
AST2-4db4ic,EMMA🥰🥰🥰🥰🥰
AST2-4db4ic,Dope!!!
AST2-4db4ic,Damn this trailer always makes me tear... can’t wait to see this film.
AST2-4db4ic,saoirse ronan is no Winona Ryder and Emma Watson is no trini Alvarado. Thank you but no thank you.  That tiny bit was enough to tell me it's just going to be more overacting by the both of them.  I'm all set.  I know the 1994 version wasn't the first. I've seen them all and read the book I love the story. I feel like the 1994 cast nailed it and this will pale in comparison.
AST2-4db4ic,Damn that’s an all-star cast if I’ve ever seen one...
AST2-4db4ic,I didn't actually want to see this. Nothing will top Winona for me. But I'm interested now!
AST2-4db4ic,it's just the trailer and i'm crying…
AST2-4db4ic,the soundtrack for this is gna take over my life soon
AST2-4db4ic,"Why has Timothée not been nominated for anything this year for Little Women or The King? And for an Oscar last year for Beautiful Boy? I wonder if he’s not playing by Hollywood’s sinister rules. If you don’t know what they are, look it up. But if it’s true, I like him even more!"
AST2-4db4ic,I love how multicultural and diverse it is
AST2-4db4ic,It was absolute perfection. Love love loved it!!!
AST2-4db4ic,Beth diesw
AST2-4db4ic,really excited for this one
AST2-4db4ic,"while I love Emma Watson and do think she's very talented, she also really needs to work on that accent lol"
AST2-4db4ic,HATE how they use modern speech in movie that's portraying time of Civil War in America
AST2-4db4ic,Leave the classics alone!
AST2-4db4ic,I've always dreamed of writing a little women retelling
AST2-4db4ic,I want to see it i love little women
AST2-4db4ic,This is the whitest movie I ever seen in my life
AST2-4db4ic,rich white girls love this movie
AST2-4db4ic,ITS HERMINOE GRANGER FROM HARRY POTTER EEEK EMMA WATSON
AST2-4db4ic,"Finally, a movie that will show how little, women actually do in the world. Enjoy the pun. Can’t wait to see this cringefest"
AST2-4db4ic,1:04 does anyone know the name of the background music? I fell in love with it.
AST2-4db4ic,watch this space lmao thisll come out and be massive BET
AST2-4db4ic,A great trailer to open for a great movie and great book ❤️
AST2-4db4ic,Did the people who made this even read the book?
AST2-4db4ic,emma 😍😍
AST2-4db4ic,"the actress that plays joe sooo looks like Winona Ryder, the actual Jo in the movie of 1994. I can’t wait to see that to see that"
AST2-4db4ic,I thought Samuel  L Jackson was going to be in this remake... wasn't there a scene when he shows up as Nick Fury and starts screaming at everyone??
AST2-4db4ic,Another film... l must say the 1949 and 1994's film adaptations were unforgettablly  the best.
AST2-4db4ic,waiting 👀👀👀
AST2-4db4ic,where. is. Louis. Garrel?
AST2-4db4ic,"Why is Jo Irish and Meg English? I know the actors are in real life, but it sounds like they didn't even attempt to use American accents in this. I'm confused..."
AST2-4db4ic,"I have the book and the author is Louisa May Alcott
I know because at the start of the book, it said “Christmas won’t be Christmas without any presents!” And there was a Christmas tree in the tralier"
AST2-4db4ic,Anyone know the second song in the trailer???
AST2-4db4ic,Anyone know the second song in the trailer???
AST2-4db4ic,"I LOVE  Saoirse Ronan but she doesn't pass for English in looks or accent in any of the clips or trailers I have seen. And Timothy doesn't pass for a love interest because he looks like a young boy. This movie did not need to be re-made so soon. Winona and Christian were perfect. This feels more Nickelodeon than complimentary to the last and best version. Greta, you are too young to try to make this project. All you are doing is showcasing new young stars rather than casting the right actors."
AST2-4db4ic,This movies about what?
AST2-4db4ic,"But will anything ever surpass March Family Letters? In any case, I love Saoirse Ronan, I hope she does as well as Winona Ryder did in 1994."
AST2-4db4ic,Saoirse Ronan is beautiful and an incredible actress 🎭💕
AST2-4db4ic,"2 words 
timothée chalamet 
😍😍😍"
AST2-4db4ic,"“But you aren’t married aunt...”
“THATS because I’m rich.” 

Meryl is killing it."
AST2-4db4ic,Ohhh I loved this book as a kid...biggest crush on Jo. Her wildness shouldn’t be tamed
AST2-4db4ic,"I am so excited for this movie, I watch the trailer so many times and it gives me goosebumps and a smile every time"
AST2-4db4ic,"Emma Watson, Meryl Streep.  I'll pass."
AST2-4db4ic,I AM SCREAMING
AST2-4db4ic,you simply cant show me that kind of raw chemistry between saoirse and timothee with me knowing how it ends. you simply cant.
AST2-4db4ic,Why can't Jo and Laurie be together it's really maddening ugh
AST2-4db4ic,"Greta Swedia haaaaaaaaaaaaa ,global warming"
AST2-4db4ic,"I'm sorry...but NO! The only Little Women movie that should exist stars Winona Ryder, Christian Bale, Susan Sarandon, Claire Danes and Kirsten Dunst...just to name some of the amazing cast. This movie could NEVER compare..."
AST2-4db4ic,I don't know if I will like it. It feels as if the story evoke a sense of feminist ideals. The older version with Wynona focus only on the lives of four women and how they lived their lives. This new version seems like going towards women's rights or suffrages.
AST2-4db4ic,"Meryl Streep, Laura Dern, Ronan, Chalamet, Watson, Pugh!!!!! This is an ALL-STAR Oscar-wining cast!"
AST2-4db4ic,"Based on “Little Women”? They understate the point. This isn’t “ Little Women” at all! If you loved the work of Louisa Alcott, have read the classic work and seen previous films that are truly based on her work and expect to find that enchantment here you will be disappointed. This is a revamping, a repurposing of Alcott’s work. I really wish they would have just not used Alcott’s work in this way."
AST2-4db4ic,Greta Gerwig is amazing.
AST2-4db4ic,"Tis the season, another winter where I rewatch a Greta Gerwig film trailer over, and over, and over again."
AST2-4db4ic,Little women fans consider watching Anne with an E on Netflix season 3 comes out January 3rd you won’t regret it
AST2-4db4ic,I’m sorry but no “Little Women” adaptation will beat 1994s one. Christian Bale and Winona Ryder! The acting and storytelling is too beautiful!
AST2-4db4ic,None of the actors for the March sisters are Americans. Just saying.
AST2-4db4ic,"Omg, I remember I used to be watching The Tales of Little Women anime ver... Now there is a movie? Can't wait"
AST2-4db4ic,I'll stay with the 94 version thank you very much
AST2-4db4ic,Meryl Streep... No thanks. I'm out.
AST2-4db4ic,"“I’m sick of it!” 😂🤣😂 wow, lost me right there. Looks nowhere NEAR previous versions. Sad!"
AST2-4db4ic,I always loved that Jo refused to  be Laurie's manic pixie dream girl.
AST2-4db4ic,One day they'll make a Little Woman movie that actually resembles the book.
AST2-4db4ic,I have watched this trailer so many times I can't WAIT
AST2-4db4ic,"I’m hoping this could bring attention towards the show Anne with an E as it is very similar and shares the same ideas. 

Please consider watching the show on Netflix , season 3 is coming on January 3rd ♡"
AST2-4db4ic,I’m sorry but you just can’t remake the masterpiece of the 1998 version!
AST2-4db4ic,Florence did a marvellous job in Midsommar. I can’t forget the scene where she mourns her parents death and bf cheating scene. Damn this cast looks AMAZING. I just recently realized Sanorise is a gem
AST2-4db4ic,This movie is from a storybook! Omg
AST2-4db4ic,"I keep on watching the Winona version, but THIS...would likely give it justice. It's perfect cast!"
AST2-4db4ic,To everyone complaining: just don't watch it. Simple.
AST2-4db4ic,"You're not married
""Well that's because I am rich""

hoping to use that line one day to my brown family"
AST2-4db4ic,This is so nostalgic!! I can't wait already 😭🥰🥰
AST2-4db4ic,Can't wait for this film. Lady bird was awesome
AST2-4db4ic,"FINALLY, A MOVIE ON THIS GREAT BOOK I've been reading meg jo beth and amy the modern retelling of little women and i saw this and i was excited"
AST2-4db4ic,I'm gonna say it: This film will not be the same without a young Christian Bale at the helm
AST2-4db4ic,The talent is seeping thru
AST2-4db4ic,No
AST2-4db4ic,In the book they are young teens but now they are adults.?
AST2-4db4ic,"Who else is in love with the song they put on the 2nd part of the trailer, it weirdly brings me to tears...I don't like that it does that to me lol"
AST2-4db4ic,Me: Saoirse Ronan and Emma Watson? TAKE MY MONEY!
AST2-4db4ic,What's the song at 1:45
AST2-4db4ic,Why does Beth look the youngest in this? It should be Amy
AST2-4db4ic,"Beth is really really sick..... 
Jo’s there but I don’t think there’s anything she could do"
AST2-4db4ic,Omg My Favorite Actresses on here I am going to see this Movie its Beautiful
AST2-4db4ic,Emma Watson is bacc!!!!
AST2-4db4ic,i love it
AST2-4db4ic,Does Saoirse keep her Irish accent?
AST2-4db4ic,Anyone know the music?
AST2-4db4ic,Feminst propaganda at its finest.
AST2-4db4ic,Florence Pugh is a masterpiece
AST2-4db4ic,Anybody crying it ruined it for them😅
AST2-4db4ic,"Omg so many great actresses in one movie, so thrilled about this"
AST2-4db4ic,Only watching for Timmy
AST2-4db4ic,Looks way better than Charlie's Angels
AST2-4db4ic,"Who has READ Little Women?🙋‍♀️
Hit like!"
AST2-4db4ic,"I’m so excited for this!!
Did anyone else notice that none of the actresses playing American girls are American! I don’t mind - just funny! They all do an amazing American accent 😊"
AST2-4db4ic,"“But you weren’t married to-“
“THATS BECAUSE IM RICH!”"
AST2-4db4ic,Emma Watson happy birthday party sisters
AST2-4db4ic,VERY BORING LITTLE WOMEN
AST2-4db4ic,Florence Pugh has been killing it this year!!
AST2-4db4ic,if they had casted maggie smith as the aunt then i would have died happy
AST2-4db4ic,"WINONA FOREVER!!!! 
THIS IS TRASH"
AST2-4db4ic,is this the one with John Johnson (Troy Bolton’s dad from HSM) in it??
AST2-4db4ic,WATCHING FOR TIMOTHEE AND EMMA
AST2-4db4ic,"1:59 bruh, gay"
AST2-4db4ic,I'm interested in the  movie because I love the book and many of the actors in it. The language in places is too modern for the time period that the events take place in.
AST2-4db4ic,Incoming flop
AST2-4db4ic,Timothee is the most attractive person I have ever laid eyes one
AST2-4db4ic,F•R•I•E•N•D•S fans knows that Beth dies.
AST2-4db4ic,The women in this film!! Amazing
AST2-4db4ic,sy dl punya buku cerita little women.. dn ini buku pertama yg sy punya ketika masa kecil.. skrg bukunya entah kemana.. tp ceritanya selalu melekat di ingatan saya... ❤❤❤
AST2-4db4ic,saoirse BETTER win an oscar istg.
AST2-4db4ic,"I LOVE LITTLE WOMEN 
ITS LITERALLY THE BEST FRICKEN BOOK EVERR"
AST2-4db4ic,"Timothee.Chalomet, in that outfit, oh lord"
AST2-4db4ic,i love timothee idk he’s just so beautiful
AST2-4db4ic,love
AST2-4db4ic,I expected Emma Watson to be in this movie. Feminist
AST2-4db4ic,"""So...who does she marry?"" Hilarious"
AST2-4db4ic,Nope. Winona forever.
AST2-4db4ic,I teared up just because the trailer. Loved the books! Loved the original movie! Cannot wait for the new one.
AST2-4db4ic,OMG I’M READING THE BOOK! :o
AST2-4db4ic,So much talent in one movie!
